# x86 instruction set description version 0.2, 2023-03-05
"LEA r64, m","LEAQ m, r64","leaq m, r64","REX.W 8D /r","N.E.","V","","","","Y","64","Store effective address for m in register r64."
"LEAVE","LEAVEW/LEAVEL/LEAVEQ","leavew/leavel/leaveq","C9","V","N.E.","","operand32","","Y","","Set ESP to EBP, then pop EBP."
"LEAVE","LEAVEW/LEAVEL/LEAVEQ","leavew/leavel/leaveq","C9","V","V","","operand16","","Y","","Set SP to BP, then pop BP."
"LEAVE","LEAVEW/LEAVEL/LEAVEQ","leavew/leavel/leaveq","C9","N.E.","V","","operand32,operand64","","Y","","Set RSP to RBP, then pop RBP."
"LES r16, m16:16","LESW m16:16, r16","lesw m16:16, r16","C4 /r","V","I","","operand16","","Y","16","Load ES:r16 with far pointer from memory."
"LES r32, m16:32","LESL m16:32, r32","lesl m16:32, r32","C4 /r","V","I","","operand32","","Y","32","Load ES:r32 with far pointer from memory."
"LFS r16, m16:16","LFSW m16:16, r16","lfsw m16:16, r16","0F B4 /r","V","V","","operand16","","Y","16","Load FS:r16 with far pointer from memory."
"LFS r32, m16:32","LFSL m16:32, r32","lfsl m16:32, r32","0F B4 /r","V","V","","operand32","","Y","32","Load FS:r32 with far pointer from memory."
"LFS r64, m16:64","LFSQ m16:64, r64","lfsq m16:64, r64","REX.W 0F B4 /r","N.E.","V","","","","Y","64","Load FS:r64 with far pointer from memory."
"LGDT m16&32","LGDTW/LGDTL m16&32","lgdtw/lgdtl m16&32","0F 01 /2","V","N.E.","","","","","","Load m into GDTR."
"LGDT m16&64","LGDT m16&64","lgdt m16&64","0F 01 /2","N.E.","V","","","","","","Load m into GDTR."
"LGS r16, m16:16","LGSW m16:16, r16","lgsw m16:16, r16","0F B5 /r","V","V","","operand16","","Y","16","Load GS:r16 with far pointer from memory."
"LGS r32, m16:32","LGSL m16:32, r32","lgsl m16:32, r32","0F B5 /r","V","V","","operand32","","Y","32","Load GS:r32 with far pointer from memory."
"LGS r64, m16:64","LGSQ m16:64, r64","lgsq m16:64, r64","REX.W 0F B5 /r","N.E.","V","","","","Y","64","Load GS:r64 with far pointer from memory."
"LIDT m16&32","LIDTW/LIDTL m16&32","lidtw/lidtl m16&32","0F 01 /3","V","N.E.","","","","","","Load m into IDTR."
"LIDT m16&64","LIDT m16&64","lidt m16&64","0F 01 /3","N.E.","V","","","","","","Load m into IDTR."
"LLDT r/m16","LLDT r/m16","lldt r/m16","0F 00 /2","V","V","","","","","","Load segment selector r/m16 into LDTR."
"LMSW r/m16","LMSW r/m16","lmsw r/m16","0F 01 /6","V","V","","","","","","Loads r/m16 in machine status word of CR0."
"LOADIWKEY xmm1, xmm2, <EAX>, <XMM0>","LOADIWKEY <XMM0>, <EAX>, xmm2, xmm1","loadiwkey <XMM0>, <EAX>, xmm2, xmm1","F3 0F 38 DC 11:rrr:bbb","V","V","KL","","","","","Load internal wrapping key from xmm1, xmm2, and XMM0."
"LODSB","LODSB","lodsb","AC","V","V","","","","","","For legacy mode, Load byte at address DS:(E)SI into AL. For 64-bit mode load byte at address (R)SI into AL."
"LODSD","LODSL","lodsl","AD","V","V","","operand32","","","","For legacy mode, Load dword at address DS:(E)SI into EAX. For 64-bit mode load dword at address (R)SI into EAX."
"LODSQ","LODSQ","lodsq","REX.W AD","N.E.","V","","","","","","Load qword at address (R)SI into RAX."
"LODSW","LODSW","lodsw","AD","V","V","","operand16","","","","For legacy mode, Load word at address DS:(E)SI into AX. For 64-bit mode load word at address (R)SI into AX."
"LOOP rel8","LOOP rel8","loop rel8","E2 cb","V","V","","","","","","Decrement count; jump short if count ≠ 0."
"LOOPE rel8","LOOPEQ rel8","loope rel8","E1 cb","V","V","","","","","","Decrement count; jump short if count ≠ 0 and ZF = 1."
"LOOPNE rel8","LOOPNE rel8","loopne rel8","E0 cb","V","V","","","","","","Decrement count; jump short if count ≠ 0 and ZF = 0."
"LSL r16, r/m16","LSLW r/m16, r16","lslw r/m16, r16","0F 03 /r","V","V","","operand16","","Y","16","Load: r16 := segment limit, selector r16/m16."
"LSL r32, r32/m16","LSLL r32/m16, r32","lsll r32/m16, r32","0F 03 /r","V","V","","operand32","","Y","32","Load: r32 := segment limit, selector r32/m16."
"LSL r64, r32/m16","LSLQ r32/m16, r64","lslq r32/m16, r64","REX.W 0F 03 /r","V","V","","","","Y","64","Load: r64 := segment limit, selector r32/m16"
"LSS r16, m16:16","LSSW m16:16, r16","lssw m16:16, r16","0F B2 /r","V","V","","operand16","","Y","16","Load SS:r16 with far pointer from memory."
"LSS r32, m16:32","LSSL m16:32, r32","lssl m16:32, r32","0F B2 /r","V","V","","operand32","","Y","32","Load SS:r32 with far pointer from memory."
"LSS r64, m16:64","LSSQ m16:64, r64","lssq m16:64, r64","REX.W 0F B2 /r","N.E.","V","","","","Y","64","Load SS:r64 with far pointer from memory."
"LTR r/m16","LTR r/m16","ltr r/m16","0F 00 /3","V","V","","","","","","Load r/m16 into task register."
"LZCNT r16, r/m16","LZCNTW r/m16, r16","lzcntw r/m16, r16","F3 0F BD /r","V","V","LZCNT","operand16","","Y","16","Count the number of leading zero bits in r/m16, return result in r16."
"LZCNT r32, r/m32","LZCNTL r/m32, r32","lzcntl r/m32, r32","F3 0F BD /r","V","V","LZCNT","operand32","","Y","32","Count the number of leading zero bits in r/m32, return result in r32."
"LZCNT r64, r/m64","LZCNTQ r/m64, r64","lzcntq r/m64, r64","F3 REX.W 0F BD /r","N.E.","V","LZCNT","","","Y","64","Count the number of leading zero bits in r/m64, return result in r64."
"MASKMOVDQU xmm1, xmm2","MASKMOVOU xmm2, xmm1","maskmovdqu xmm2, xmm1","66 0F F7 /r","V","V","SSE2","","","","","Selectively write bytes from xmm1 to memory location using the byte mask in xmm2. The default memory location is specified by DS:DI/EDI/RDI."
"MASKMOVQ mm1, mm2","MASKMOVQ mm2, mm1","maskmovq mm2, mm1","NP 0F F7 /r","V","V","","","","","","Selectively write bytes from mm1 to memory location using the byte mask in mm2. The default memory location is specified by DS:DI/EDI/RDI."
"MAXPD xmm1, xmm2/m128","MAXPD xmm2/m128, xmm1","maxpd xmm2/m128, xmm1","66 0F 5F /r","V","V","SSE2","","","","","Return the maximum double precision floating-point values between xmm1 and xmm2/m128."
"MAXPS xmm1, xmm2/m128","MAXPS xmm2/m128, xmm1","maxps xmm2/m128, xmm1","NP 0F 5F /r","V","V","SSE","","","","","Return the maximum single precision floating-point values between xmm1 and xmm2/mem."
"MAXSD xmm1, xmm2/m64","MAXSD xmm2/m64, xmm1","maxsd xmm2/m64, xmm1","F2 0F 5F /r","V","V","SSE2","","","","","Return the maximum scalar double precision floating-point value between xmm2/m64 and xmm1."
"MAXSS xmm1, xmm2/m32","MAXSS xmm2/m32, xmm1","maxss xmm2/m32, xmm1","F3 0F 5F /r","V","V","SSE","","","","","Return the maximum scalar single precision floating-point value between xmm2/m32 and xmm1."
"MINPD xmm1, xmm2/m128","MINPD xmm2/m128, xmm1","minpd xmm2/m128, xmm1","66 0F 5D /r","V","V","SSE2","","","","","Return the minimum double precision floating-point values between xmm1 and xmm2/mem"
"MINPS xmm1, xmm2/m128","MINPS xmm2/m128, xmm1","minps xmm2/m128, xmm1","NP 0F 5D /r","V","V","SSE","","","","","Return the minimum single precision floating-point values between xmm1 and xmm2/mem."
"MINSD xmm1, xmm2/m64","MINSD xmm2/m64, xmm1","minsd xmm2/m64, xmm1","F2 0F 5D /r","V","V","SSE2","","","","","Return the minimum scalar double precision floating- point value between xmm2/m64 and xmm1."
"MINSS xmm1, xmm2/m32","MINSS xmm2/m32, xmm1","minss xmm2/m32, xmm1","F3 0F 5D /r","V","V","SSE","","","","","Return the minimum scalar single precision floating-point value between xmm2/m32 and xmm1."
"MONITOR","MONITOR","monitor","0F 01 C8","V","V","","","","","","Sets up a linear address range to be monitored by hardware and activates the monitor. The address range should be a write- back memory caching type. The address is DS:RAX/EAX/AX."
"MOV AL, moffs8","MOVB/MOVB/MOVABSB moffs8, AL","movb/movb/movabsb moffs8, AL","A0","V","V","","ignoreREXW","","Y","8","Move byte at (seg:offset) to AL."
"MOV AL, moffs8","MOVB/MOVB/MOVABSB moffs8, AL","movb/movb/movabsb moffs8, AL","REX.W A0","N.E.","V","","pseudo","","Y","8","Move byte at (offset) to AL."
"MOV AX, moffs16","MOVW moffs16, AX","movw moffs16, AX","A1","V","V","","operand16","","Y","16","Move word at (seg:offset) to AX."
"MOV CR0-CR7, r32","MOVL r32, CR0-CR7","movl r32, CR0-CR7","0F 22 /r","V","N.E.","","","","Y","32","Move r32 to control register."
"MOV CR0-CR7, r64","MOVQ r64, CR0-CR7","movq r64, CR0-CR7","0F 22 /r","N.E.","V","","","","Y","64","Move r64 to extended control register."
"MOV CR8, r64","MOVQ r64, CR8","movq r64, CR8","REX.R + 0F 22 /0","N.E.","V","","","","Y","64","Move r64 to extended CR8."
"MOV DR0-DR7, r32","MOVL r32, DR0-DR7","movl r32, DR0-DR7","0F 23 /r","V","N.E.","","","","Y","32","Move r32 to debug register."
"MOV DR0-DR7, r64","MOVQ r64, DR0-DR7","movq r64, DR0-DR7","0F 23 /r","N.E.","V","","","","Y","64","Move r64 to extended debug register."
"MOV EAX, moffs32","MOVL moffs32, EAX","movl moffs32, EAX","A1","V","V","","operand32","","Y","32","Move doubleword at (seg:offset) to EAX."
"MOV RAX, moffs64","MOVQ moffs64, RAX","movabsq moffs64, RAX","REX.W A1","N.E.","V","","","","Y","64","Move quadword at (offset) to RAX."
"MOV Sreg, r/m16","MOVW r/m16, Sreg","movw r/m16, Sreg","8E /r","V","V","","operand16","","Y","16","Move r/m16 to segment register."
"MOV Sreg, r/m16","MOVW r/m16, Sreg","movw r/m16, Sreg","REX.W 8E /r","V","V","","","","Y","16","Move lower 16 bits of r/m64 to segment register."
"MOV Sreg, r32/m16","MOV{L/W} r32/m16, Sreg","mov{l/w} r32/m16, Sreg","8E /r","V","V","","operand32","w,r","Y","",""
"MOV moffs16, AX","MOVW AX, moffs16","movw AX, moffs16","A3","V","V","","operand16","","Y","16","Move AX to (seg:offset)."
"MOV moffs32, EAX","MOVL EAX, moffs32","movl EAX, moffs32","A3","V","V","","operand32","","Y","32","Move EAX to (seg:offset)."
"MOV moffs64, RAX","MOVQ RAX, moffs64","movabsq RAX, moffs64","REX.W A3","N.E.","V","","","","Y","64","Move RAX to (offset)."
"MOV moffs8, AL","MOVB/MOVB/MOVABSB AL, moffs8","movb/movb/movabsb AL, moffs8","A2","V","V","","ignoreREXW","","Y","8","Move AL to (seg:offset)."
"MOV moffs8, AL","MOVB/MOVB/MOVABSB AL, moffs8","movb/movb/movabsb AL, moffs8","REX.W A2","N.E.","V","","pseudo","","Y","8","Move AL to (offset)."
"MOV r/m16, Sreg","MOVW Sreg, r/m16","movw Sreg, r/m16","8C /r","V","V","","","","Y","16","Move segment register to r/m16."
"MOV r/m16, imm16","MOVW imm16, r/m16","movw imm16, r/m16","C7 /0 iw","V","V","","operand16","","Y","16","Move imm16 to r/m16."
"MOV r/m16, r16","MOVW r16, r/m16","movw r16, r/m16","89 /r","V","V","","operand16","","Y","16","Move r16 to r/m16."
"MOV r/m32, Sreg","MOVL Sreg, r/m32","movl Sreg, r/m32","8C /r","V","V","","operand32","w,r","Y","32",""
"MOV r/m32, imm32","MOVL imm32, r/m32","movl imm32, r/m32","C7 /0 id","V","V","","operand32","","Y","32","Move imm32 to r/m32."
"MOV r/m32, r32","MOVL r32, r/m32","movl r32, r/m32","89 /r","V","V","","operand32","","Y","32","Move r32 to r/m32."
"MOV r/m64, imm32","MOVQ imm32, r/m64","movq imm32, r/m64","REX.W C7 /0 id","N.E.","V","","","","Y","64","Move imm32 sign extended to 64-bits to r/m64."
"MOV r/m64, r64","MOVQ r64, r/m64","movq r64, r/m64","REX.W 89 /r","N.E.","V","","","","Y","64","Move r64 to r/m64."
"MOV r/m8, imm8u","MOVB imm8u, r/m8","movb imm8u, r/m8","C6 /0 ib","V","V","","","","Y","8","Move imm8 to r/m8."
"MOV r/m8, imm8u","MOVB imm8u, r/m8","movb imm8u, r/m8","REX C6 /0 ib","N.E.","V","","pseudo64","","Y","8","Move imm8 to r/m8."
"MOV r/m8, r8","MOVB r8, r/m8","movb r8, r/m8","88 /r","V","V","","","","Y","8","Move r8 to r/m8."
"MOV r/m8, r8","MOVB r8, r/m8","movb r8, r/m8","REX 88 /r","N.E.","V","","pseudo64","","Y","8","Move r8 to r/m8."
"MOV r16, imm16","MOVW imm16, r16","movw imm16, r16","B8+rw iw","V","V","","operand16","","Y","16","Move imm16 to r16."
"MOV r16, r/m16","MOVW r/m16, r16","movw r/m16, r16","8B /r","V","V","","operand16","","Y","16","Move r/m16 to r16."
"MOV r16/r32/m16, Sreg","MOV Sreg, r16/r32/m16","mov Sreg, r16/r32/m16","8C /r","V","V","","operand16,operand32","","Y","","Move zero extended 16-bit segment register to r16/r32/m16."
"MOV r32, CR0-CR7","MOVL CR0-CR7, r32","movl CR0-CR7, r32","0F 20 /r","V","N.E.","","","","Y","32","Move control register to r32."
"MOV r32, DR0-DR7","MOVL DR0-DR7, r32","movl DR0-DR7, r32","0F 21 /r","V","N.E.","","","","Y","32","Move debug register to r32."
"MOV r32, imm32","MOVL imm32, r32","movl imm32, r32","B8+rd id","V","V","","operand32","","Y","32","Move imm32 to r32."
"MOV r32, r/m32","MOVL r/m32, r32","movl r/m32, r32","8B /r","V","V","","operand32","","Y","32","Move r/m32 to r32."
"MOV r64, CR0-CR7","MOVQ CR0-CR7, r64","movq CR0-CR7, r64","0F 20 /r","N.E.","V","","","","Y","64","Move extended control register to r64."
"MOV r64, CR8","MOVQ CR8, r64","movq CR8, r64","REX.R + 0F 20 /0","N.E.","V","","","","Y","64","Move extended CR8 to r64."
"MOV r64, DR0-DR7","MOVQ DR0-DR7, r64","movq DR0-DR7, r64","0F 21 /r","N.E.","V","","","","Y","64","Move extended debug register to r64."
"MOV r64, imm64","MOVQ imm64, r64","movq imm64, r64","REX.W B8+rd io","N.E.","V","","","","Y","64","Move imm64 to r64."
"MOV r64, r/m64","MOVQ r/m64, r64","movq r/m64, r64","REX.W 8B /r","N.E.","V","","","","Y","64","Move r/m64 to r64."
"MOV r64/m16, Sreg","MOV{Q/W} Sreg, r64/m16","mov{q/w} Sreg, r64/m16","REX.W 8C /r","V","V","","","","Y","","Move zero extended 16-bit segment register to r64/m16."
"MOV r8, imm8","MOVB imm8, r8","movb imm8, r8","B0+rb ib","V","V","","","","Y","8","Move imm8 to r8."
"MOV r8, imm8","MOVB imm8, r8","movb imm8, r8","REX B0+rb ib","N.E.","V","","pseudo64","","Y","8","Move imm8 to r8."
"MOV r8, r/m8","MOVB r/m8, r8","movb r/m8, r8","8A /r","V","V","","","","Y","8","Move r/m8 to r8."
"MOV r8, r/m8","MOVB r/m8, r8","movb r/m8, r8","REX 8A /r","N.E.","V","","pseudo64","","Y","8","Move r/m8 to r8."
"MOVAPD xmm1, xmm2/m128","MOVAPD xmm2/m128, xmm1","movapd xmm2/m128, xmm1","66 0F 28 /r","V","V","SSE2","","","","","Move aligned packed double precision floating- point values from xmm2/mem to xmm1."
"MOVAPD xmm2/m128, xmm1","MOVAPD xmm1, xmm2/m128","movapd xmm1, xmm2/m128","66 0F 29 /r","V","V","SSE2","","","","","Move aligned packed double precision floating- point values from xmm1 to xmm2/mem."
"MOVAPS xmm1, xmm2/m128","MOVAPS xmm2/m128, xmm1","movaps xmm2/m128, xmm1","NP 0F 28 /r","V","V","SSE","","","","","Move aligned packed single precision floating-point values from xmm2/mem to xmm1."
"MOVAPS xmm2/m128, xmm1","MOVAPS xmm1, xmm2/m128","movaps xmm1, xmm2/m128","NP 0F 29 /r","V","V","SSE","","","","","Move aligned packed single precision floating-point values from xmm1 to xmm2/mem."
"MOVBE m16, r16","MOVBEWW r16, m16","movbeww r16, m16","0F 38 F1 /r","V","V","MOVBE","operand16","","Y","16","Reverse byte order in r16 and move to m16."
"MOVBE m32, r32","MOVBELL r32, m32","movbell r32, m32","0F 38 F1 /r","V","V","MOVBE","operand32","","Y","32","Reverse byte order in r32 and move to m32."
"MOVBE m64, r64","MOVBEQQ r64, m64","movbeqq r64, m64","REX.W 0F 38 F1 /r","N.E.","V","MOVBE","","","Y","64","Reverse byte order in r64 and move to m64."
"MOVBE r16, m16","MOVBEWW m16, r16","movbeww m16, r16","0F 38 F0 /r","V","V","MOVBE","operand16","","Y","16","Reverse byte order in m16 and move to r16."
"MOVBE r32, m32","MOVBELL m32, r32","movbell m32, r32","0F 38 F0 /r","V","V","MOVBE","operand32","","Y","32","Reverse byte order in m32 and move to r32."
"MOVBE r64, m64","MOVBEQQ m64, r64","movbeqq m64, r64","REX.W 0F 38 F0 /r","N.E.","V","MOVBE","","","Y","64","Reverse byte order in m64 and move to r64."
"MOVD mm, r/m32","MOVD r/m32, mm","movd r/m32, mm","NP 0F 6E /r","V","V","MMX","operand16,operand32","","","","Move doubleword from r/m32 to mm."
"MOVD r/m32, mm","MOVD mm, r/m32","movd mm, r/m32","NP 0F 7E /r","V","V","MMX","operand16,operand32","","","","Move doubleword from mm to r/m32."
"MOVD r/m32, xmm","MOVD xmm, r/m32","movd xmm, r/m32","66 0F 7E /r","V","V","SSE2","operand16,operand32","","","","Move doubleword from xmm register to r/m32."
"MOVD xmm, r/m32","MOVD r/m32, xmm","movd r/m32, xmm","66 0F 6E /r","V","V","SSE2","operand16,operand32","","","","Move doubleword from r/m32 to xmm."
"MOVDIR64B r16/r32/r64, m512","MOVDIR64B m512, r16/r32/r64","movdir64b m512, r16/r32/r64","66 0F 38 F8 /r","V","V","MOVDIR64B","","","","","Move 64-bytes as direct-store with guaranteed 64- byte write atomicity from the source memory operand address to destination memory address specified as offset to ES segment in the register operand."
"MOVDIRI m32, r32","MOVDIRIL r32, m32","movdiril r32, m32","NP 0F 38 F9 /r","V","V","MOVDIRI","operand16,operand32","","Y","32","Move doubleword from r32 to m32 using direct store."
"MOVDIRI m64, r64","MOVDIRIQ r64, m64","movdiriq r64, m64","NP REX.W 0F 38 F9 /r","N.E.","V","MOVDIRI","","","Y","64","Move quadword from r64 to m64 using direct store."
"MOVDQ2Q mm, xmm","MOVQ xmm, mm","movdq2q xmm, mm","F2 0F D6 /r","V","V","","","","","","Move low quadword from xmm to mmx register."
"MOVDQA xmm1, xmm2/m128","MOVO xmm2/m128, xmm1","movdqa xmm2/m128, xmm1","66 0F 6F /r","V","V","SSE2","","","","","Move aligned packed integer values from xmm2/mem to xmm1."
"MOVDQA xmm2/m128, xmm1","MOVO xmm1, xmm2/m128","movdqa xmm1, xmm2/m128","66 0F 7F /r","V","V","SSE2","","","","","Move aligned packed integer values from xmm1 to xmm2/mem."
"MOVHLPS xmm1, xmm2","MOVHLPS xmm2, xmm1","movhlps xmm2, xmm1","NP 0F 12 /r","V","V","SSE","","","","","Move two packed single precision floating-point values from high quadword of xmm2 to low quadword of xmm1."
"MOVLHPS xmm1, xmm2","MOVLHPS xmm2, xmm1","movlhps xmm2, xmm1","NP 0F 16 /r","V","V","SSE","","","","","Move two packed single precision floating-point values from low quadword of xmm2 to high quadword of xmm1."
"MOVMSKPD reg, xmm","MOVMSKPD xmm, reg","movmskpd xmm, reg","66 0F 50 /r","V","V","SSE2","","","","","Extract 2-bit sign mask from xmm and store in reg. The upper bits of r32 or r64 are filled with zeros."
"MOVMSKPS reg, xmm","MOVMSKPS xmm, reg","movmskps xmm, reg","NP 0F 50 /r","V","V","SSE","","","","","Extract 4-bit sign mask from xmm and store in reg. The upper bits of r32 or r64 are filled with zeros."
"MOVNTDQ m128, xmm1","MOVNTO xmm1, m128","movntdq xmm1, m128","66 0F E7 /r","V","V","SSE2","","","","","Move packed integer values in xmm1 to m128 using non- temporal hint."
"MOVNTDQA xmm1, m128","MOVNTDQA m128, xmm1","movntdqa m128, xmm1","66 0F 38 2A /r","V","V","SSE4_1","","","","","Move double quadword from m128 to xmm1 using non- temporal hint if WC memory type."
"MOVNTPD m128, xmm1","MOVNTPD xmm1, m128","movntpd xmm1, m128","66 0F 2B /r","V","V","SSE2","","","","","Move packed double precision values in xmm1 to m128 using non-temporal hint."
"MOVNTPS m128, xmm1","MOVNTPS xmm1, m128","movntps xmm1, m128","NP 0F 2B /r","V","V","SSE","","","","","Move packed single precision values xmm1 to mem using non-temporal hint."
"MOVNTQ m64, mm","MOVNTQ mm, m64","movntq mm, m64","NP 0F E7 /r","V","V","","","","","","Move quadword from mm to m64 using non- temporal hint."
"MOVNTSD m64, xmm1","MOVNTSD xmm1, m64","movntsd xmm1, m64","F2 0F 2B /r","V","V","SSE","","w,r","","",""
"MOVNTSS m32, xmm1","MOVNTSS xmm1, m32","movntss xmm1, m32","F3 0F 2B /r","V","V","SSE","","w,r","","",""
"MOVQ mm, mm/m64","MOVQ mm/m64, mm","movq mm/m64, mm","NP 0F 6F /r","V","V","MMX","","","","","Move quadword from mm/m64 to mm."
"MOVQ mm, r/m64","MOVQ r/m64, mm","movq r/m64, mm","NP REX.W 0F 6E /r","N.E.","V","MMX","","","","","Move quadword from r/m64 to mm."
"MOVQ mm/m64, mm","MOVQ mm, mm/m64","movq mm, mm/m64","NP 0F 7F /r","V","V","MMX","","","","","Move quadword from mm to mm/m64."
"MOVQ r/m64, mm","MOVQ mm, r/m64","movq mm, r/m64","NP REX.W 0F 7E /r","N.E.","V","MMX","","","","","Move quadword from mm to r/m64."
"MOVQ r/m64, xmm","MOVQ xmm, r/m64","movq xmm, r/m64","66 REX.W 0F 7E /r","N.E.","V","SSE2","","","","","Move quadword from xmm register to r/m64."
"MOVQ xmm, r/m64","MOVQ r/m64, xmm","movq r/m64, xmm","66 REX.W 0F 6E /r","N.E.","V","SSE2","","","","","Move quadword from r/m64 to xmm."
"MOVQ xmm1, xmm2/m64","MOVQ xmm2/m64, xmm1","movq xmm2/m64, xmm1","F3 0F 7E /r","V","V","SSE2","","","","","Move quadword from xmm2/mem64 to xmm1."
"MOVQ xmm2/m64, xmm1","MOVQ xmm1, xmm2/m64","movq xmm1, xmm2/m64","66 0F D6 /r","V","V","SSE2","","","","","Move quadword from xmm1 to xmm2/mem64."
"MOVSB","MOVSB","movsb","A4","V","V","","","","","","For legacy mode, Move byte from address DS:(E)SI to ES:(E)DI. For 64-bit mode move byte from address (R|E)SI to (R|E)DI."
"MOVSD","MOVSL","movsl","A5","V","V","","operand32","","","","For legacy mode, move dword from address DS:(E)SI to ES:(E)DI. For 64-bit mode move dword from address (R|E)SI to (R|E)DI."
"MOVSHDUP xmm1, xmm2/m128","MOVSHDUP xmm2/m128, xmm1","movshdup xmm2/m128, xmm1","F3 0F 16 /r","V","V","SSE3","","","","","Move odd index single precision floating-point values from xmm2/mem and duplicate each element into xmm1."
"MOVSQ","MOVSQ","movsq","REX.W A5","N.E.","V","","","","","","Move qword from address (R|E)SI to (R|E)DI."
"MOVSW","MOVSW","movsw","A5","V","V","","operand16","","","","For legacy mode, move word from address DS:(E)SI to ES:(E)DI. For 64-bit mode move word at address (R|E)SI to (R|E)DI."
"MOVSX r16, r/m16","MOVSWW r/m16, r16","movsww r/m16, r16","0F BF /r","V","V","","operand16","w,r","Y","16",""
"MOVSX r16, r/m8","MOVBWSX r/m8, r16","movsbw r/m8, r16","0F BE /r","V","V","","operand16","","Y","16","Move byte to word with sign-extension."
"MOVSX r32, r/m16","MOVWLSX r/m16, r32","movswl r/m16, r32","0F BF /r","V","V","","operand32","","Y","32","Move word to doubleword, with sign- extension."
"MOVSX r32, r/m8","MOVBLSX r/m8, r32","movsbl r/m8, r32","0F BE /r","V","V","","operand32","","Y","32","Move byte to doubleword with sign- extension."
"MOVSX r64, r/m16","MOVWQSX r/m16, r64","movswq r/m16, r64","REX.W 0F BF /r","N.E.","V","","","","Y","64","Move word to quadword with sign-extension."
"MOVSX r64, r/m8","MOVBQSX r/m8, r64","movsbq r/m8, r64","REX.W 0F BE /r","N.E.","V","","","","Y","64","Move byte to quadword with sign-extension."
"MOVSXD r16, r/m16","MOVWQSX r/m16, r16","movsxdw r/m16, r16","63 /r","N.E.","V","","operand16","","Y","16","Move word to word with sign-extension."
"MOVSXD r16, r/m32","MOVWQSX r/m32, r16","movsxdw r/m32, r16","63 /r","N.E.","V","","operand16","w,r","Y","16",""
"MOVSXD r32, r/m32","MOVLQSX r/m32, r32","movsxdl r/m32, r32","63 /r","N.E.","V","","operand32","w,r","Y","32",""
"MOVSXD r32, r/m32","MOVLQSX r/m32, r32","movsxdl r/m32, r32","63 /r","N.E.","V","","operand32","","Y","32","Move doubleword to doubleword with sign- extension."
"MOVSXD r64, r/m32","MOVLQSX r/m32, r64","movslq r/m32, r64","REX.W 63 /r","N.E.","V","","","","Y","64","Move doubleword to quadword with sign- extension."
"MOVZX r16, r/m16","MOVZWW r/m16, r16","movzww r/m16, r16","0F B7 /r","V","V","","operand16","w,r","Y","16",""
"MOVZX r16, r/m8","MOVBWZX r/m8, r16","movzbw r/m8, r16","0F B6 /r","V","V","","operand16","","Y","16","Move byte to word with zero-extension."
"MOVZX r32, r/m16","MOVWLZX r/m16, r32","movzwl r/m16, r32","0F B7 /r","V","V","","operand32","","Y","32","Move word to doubleword, zero-extension."
"MOVZX r32, r/m8","MOVBLZX r/m8, r32","movzbl r/m8, r32","0F B6 /r","V","V","","operand32","","Y","32","Move byte to doubleword, zero-extension."
"MOVZX r64, r/m16","MOVWQZX r/m16, r64","movzwq r/m16, r64","REX.W 0F B7 /r","N.E.","V","","","","Y","64","Move word to quadword, zero-extension."
"MOVZX r64, r/m8","MOVBQZX r/m8, r64","movzbq r/m8, r64","REX.W 0F B6 /r","N.E.","V","","","","Y","64","Move byte to quadword, zero-extension."
"MPSADBW xmm1, xmm2/m128, imm8","MPSADBW imm8, xmm2/m128, xmm1","mpsadbw imm8, xmm2/m128, xmm1","66 0F 3A 42 /r ib","V","V","SSE4_1","","","","","Sums absolute 8-bit integer difference of adjacent groups of 4 byte integers in xmm1 and xmm2/m128 and writes the results in xmm1. Starting offsets within xmm1 and xmm2/m128 are determined by imm8."
"MUL r/m16","MULW r/m16","mulw r/m16","F7 /4","V","V","","operand16","","Y","16","Unsigned multiply (DX:AX := AX ∗ r/m16)."
"MUL r/m32","MULL r/m32","mull r/m32","F7 /4","V","V","","operand32","","Y","32","Unsigned multiply (EDX:EAX := EAX ∗ r/m32)."
"MUL r/m64","MULQ r/m64","mulq r/m64","REX.W F7 /4","N.E.","V","","","","Y","64","Unsigned multiply (RDX:RAX := RAX ∗ r/m64)."
"MUL r/m8","MULB r/m8","mulb r/m8","F6 /4","V","V","","","","Y","8","Unsigned multiply (AX := AL ∗ r/m8)."
"MUL r/m8","MULB r/m8","mulb r/m8","REX F6 /4","N.E.","V","","pseudo64","","Y","8","Unsigned multiply (AX := AL ∗ r/m8)."
"MULPD xmm1, xmm2/m128","MULPD xmm2/m128, xmm1","mulpd xmm2/m128, xmm1","66 0F 59 /r","V","V","SSE2","","","","","Multiply packed double precision floating-point values in xmm2/m128 with xmm1 and store result in xmm1."
"MULPS xmm1, xmm2/m128","MULPS xmm2/m128, xmm1","mulps xmm2/m128, xmm1","NP 0F 59 /r","V","V","SSE","","","","","Multiply packed single precision floating-point values in xmm2/m128 with xmm1 and store result in xmm1."
"MULSD xmm1, xmm2/m64","MULSD xmm2/m64, xmm1","mulsd xmm2/m64, xmm1","F2 0F 59 /r","V","V","SSE2","","","","","Multiply the low double precision floating-point value in xmm2/m64 by low double precision floating-point value in xmm1."
"MULSS xmm1, xmm2/m32","MULSS xmm2/m32, xmm1","mulss xmm2/m32, xmm1","F3 0F 59 /r","V","V","SSE","","","","","Multiply the low single precision floating-point value in xmm2/m32 by the low single precision floating-point value in xmm1."
"MULX r32a, r32b, r/m32","MULXL r/m32, r32b, r32a","mulxl r/m32, r32b, r32a","VEX.LZ.F2.0F38.W0 F6 /r","V","V","BMI2","","","Y","32","Unsigned multiply of r/m32 with EDX without affecting arithmetic flags."
"MULX r64a, r64b, r/m64","MULXQ r/m64, r64b, r64a","mulxq r/m64, r64b, r64a","VEX.LZ.F2.0F38.W1 F6 /r","N.E.","V","BMI2","","","Y","64","Unsigned multiply of r/m64 with RDX without affecting arithmetic flags."
"MWAIT","MWAIT","mwait","0F 01 C9","V","V","","","","","","A hint that allows the processor to stop instruction execution and enter an implementation-dependent optimized state until occurrence of a class of events."
"NEG r/m16","NEGW r/m16","negw r/m16","F7 /3","V","V","","operand16","","Y","16","Two's complement negate r/m16."
