# x86 instruction set description version 0.2, 2023-03-05
"VPCMPGTQ k1 {k2}, zmm2, zmm3/m512/m64bcst","VPCMPGTQ zmm3/m512/m64bcst, zmm2, k1 {k2}","vpcmpgtq zmm3/m512/m64bcst, zmm2, k1 {k2}","EVEX.512.66.0F38.W1 37 /r","V","V","AVX512F","","","","","Compare Greater between int64 vector zmm2 and int64 vector zmm3/m512/m64bcst, and set vector mask k1 to reflect the zero/nonzero status of each element of the result, under writemask."
"VPCMPGTQ xmm1, xmm2, xmm3/m128","VPCMPGTQ xmm3/m128, xmm2, xmm1","vpcmpgtq xmm3/m128, xmm2, xmm1","VEX.128.66.0F38.WIG 37 /r","V","V","AVX","","","","","Compare packed signed qwords in xmm2 and xmm3/m128 for greater than."
"VPCMPGTQ ymm1, ymm2, ymm3/m256","VPCMPGTQ ymm3/m256, ymm2, ymm1","vpcmpgtq ymm3/m256, ymm2, ymm1","VEX.256.66.0F38.WIG 37 /r","V","V","AVX2","","","","","Compare packed signed qwords in ymm2 and ymm3/m256 for greater than."
"VPCMPGTW xmm1, xmm2, xmm3/m128","VPCMPGTW xmm3/m128, xmm2, xmm1","vpcmpgtw xmm3/m128, xmm2, xmm1","VEX.128.66.0F.WIG 65 /r","V","V","AVX","","","","","Compare packed signed word integers in xmm2 and xmm3/m128 for greater than."
"VPCMPGTW ymm1, ymm2, ymm3/m256","VPCMPGTW ymm3/m256, ymm2, ymm1","vpcmpgtw ymm3/m256, ymm2, ymm1","VEX.256.66.0F.WIG 65 /r","V","V","AVX2","","","","","Compare packed signed word integers in ymm2 and ymm3/m256 for greater than."
"VPCMPISTRI xmm1, xmm2/m128, imm8","VPCMPISTRI imm8, xmm2/m128, xmm1","vpcmpistri imm8, xmm2/m128, xmm1","VEX.128.66.0F3A.WIG 63 /r ib","V","V","AVX","","","","","Perform a packed comparison of string data with implicit lengths, generating an index, and storing the result in ECX."
"VPCMPISTRM xmm1, xmm2/m128, imm8","VPCMPISTRM imm8, xmm2/m128, xmm1","vpcmpistrm imm8, xmm2/m128, xmm1","VEX.128.66.0F3A.WIG 62 /r ib","V","V","AVX","","","","","Perform a packed comparison of string data with implicit lengths, generating a Mask, and storing the result in XMM0."
"VPEXTRB reg/m8, xmm2, imm8","VPEXTRB imm8, xmm2, reg/m8","vpextrb imm8, xmm2, reg/m8","EVEX.128.66.0F3A.WIG 14 /r ib","V","V","AVX512BW","","","Y","","Extract a byte integer value from xmm2 at the source byte offset specified by imm8 into reg or m8. The upper bits of r64/r32 is filled with zeros."
"VPEXTRB reg/m8, xmm2, imm8","VPEXTRB imm8, xmm2, reg/m8","vpextrb imm8, xmm2, reg/m8","VEX.128.66.0F3A.W0 14 /r ib","V","V","AVX","","","Y","","Extract a byte integer value from xmm2 at the source byte offset specified by imm8 into reg or m8. The upper bits of r64/r32 is filled with zeros."
"VPEXTRD r/m32, xmm2, imm8","VPEXTRDL imm8, xmm2, r/m32","vpextrdl imm8, xmm2, r/m32","EVEX.128.66.0F3A.W0 16 /r ib","V","V","AVX512DQ","","","Y","32","Extract a dword integer value from xmm2 at the source dword offset specified by imm8 into r32/m32."
"VPEXTRD r/m32, xmm2, imm8","VPEXTRDL imm8, xmm2, r/m32","vpextrdl imm8, xmm2, r/m32","VEX.128.66.0F3A.W0 16 /r ib","V","V","AVX","","","Y","32","Extract a dword integer value from xmm2 at the source dword offset specified by imm8 into r32/m32."
"VPEXTRQ r/m64, xmm2, imm8","VPEXTRQQ imm8, xmm2, r/m64","vpextrqq imm8, xmm2, r/m64","EVEX.128.66.0F3A.W1 16 /r ib","N.E.","V","AVX512DQ","","","Y","64","Extract a qword integer value from xmm2 at the source dword offset specified by imm8 into r64/m64."
"VPEXTRQ r/m64, xmm2, imm8","VPEXTRQQ imm8, xmm2, r/m64","vpextrqq imm8, xmm2, r/m64","VEX.128.66.0F3A.W1 16 /r ib","I","V","AVX","","","Y","64","Extract a qword integer value from xmm2 at the source dword offset specified by imm8 into r64/m64."
"VPEXTRW reg, xmm1, imm8","VPEXTRW imm8, xmm1, reg","vpextrw imm8, xmm1, reg","EVEX.128.66.0F.WIG C5 /r ib","V","V","AVX512BW","","","Y","","Extract the word specified by imm8 from xmm1 and move it to reg, bits 15:0. Zero-extend the result. The upper bits of r64/r32 is filled with zeros."
"VPEXTRW reg, xmm1, imm8","VPEXTRW imm8, xmm1, reg","vpextrw imm8, xmm1, reg","VEX.128.66.0F.W0 C5 /r ib","V","V","AVX","","","Y","","Extract the word specified by imm8 from xmm1 and move it to reg, bits 15:0. Zero-extend the result. The upper bits of r64/r32 is filled with zeros."
"VPEXTRW reg/m16, xmm2, imm8","VPEXTRW imm8, xmm2, reg/m16","vpextrw imm8, xmm2, reg/m16","EVEX.128.66.0F3A.WIG 15 /r ib","V","V","AVX512BW","","","Y","","Extract a word integer value from xmm2 at the source word offset specified by imm8 into reg or m16. The upper bits of r64/r32 is filled with zeros."
"VPEXTRW reg/m16, xmm2, imm8","VPEXTRW imm8, xmm2, reg/m16","vpextrw imm8, xmm2, reg/m16","VEX.128.66.0F3A.W0 15 /r ib","V","V","AVX","","","Y","","Extract a word integer value from xmm2 at the source word offset specified by imm8 into reg or m16. The upper bits of r64/r32 is filled with zeros."
"VPHADDD xmm1, xmm2, xmm3/m128","VPHADDD xmm3/m128, xmm2, xmm1","vphaddd xmm3/m128, xmm2, xmm1","VEX.128.66.0F38.WIG 02 /r","V","V","AVX","","","","","Add 32-bit integers horizontally, pack to xmm1."
"VPHADDD ymm1, ymm2, ymm3/m256","VPHADDD ymm3/m256, ymm2, ymm1","vphaddd ymm3/m256, ymm2, ymm1","VEX.256.66.0F38.WIG 02 /r","V","V","AVX2","","","","","Add 32-bit signed integers horizontally, pack to ymm1."
"VPHADDSW xmm1, xmm2, xmm3/m128","VPHADDSW xmm3/m128, xmm2, xmm1","vphaddsw xmm3/m128, xmm2, xmm1","VEX.128.66.0F38.WIG 03 /r","V","V","AVX","","","","","Add 16-bit signed integers horizontally, pack saturated integers to xmm1."
"VPHADDSW ymm1, ymm2, ymm3/m256","VPHADDSW ymm3/m256, ymm2, ymm1","vphaddsw ymm3/m256, ymm2, ymm1","VEX.256.66.0F38.WIG 03 /r","V","V","AVX2","","","","","Add 16-bit signed integers horizontally, pack saturated integers to ymm1."
"VPHADDW xmm1, xmm2, xmm3/m128","VPHADDW xmm3/m128, xmm2, xmm1","vphaddw xmm3/m128, xmm2, xmm1","VEX.128.66.0F38.WIG 01 /r","V","V","AVX","","","","","Add 16-bit integers horizontally, pack to xmm1."
"VPHADDW ymm1, ymm2, ymm3/m256","VPHADDW ymm3/m256, ymm2, ymm1","vphaddw ymm3/m256, ymm2, ymm1","VEX.256.66.0F38.WIG 01 /r","V","V","AVX2","","","","","Add 16-bit signed integers horizontally, pack to ymm1."
"VPHMINPOSUW xmm1, xmm2/m128","VPHMINPOSUW xmm2/m128, xmm1","vphminposuw xmm2/m128, xmm1","VEX.128.66.0F38.WIG 41 /r","V","V","AVX","","","","","Find the minimum unsigned word in xmm2/m128 and place its value in the low word of xmm1 and its index in the second- lowest word of xmm1."
"VPHSUBD xmm1, xmm2, xmm3/m128","VPHSUBD xmm3/m128, xmm2, xmm1","vphsubd xmm3/m128, xmm2, xmm1","VEX.128.66.0F38.WIG 06 /r","V","V","AVX","","","","","Subtract 32-bit signed integers horizontally, pack to xmm1."
"VPHSUBD ymm1, ymm2, ymm3/m256","VPHSUBD ymm3/m256, ymm2, ymm1","vphsubd ymm3/m256, ymm2, ymm1","VEX.256.66.0F38.WIG 06 /r","V","V","AVX2","","","","","Subtract 32-bit signed integers horizontally, pack to ymm1."
"VPHSUBSW xmm1, xmm2, xmm3/m128","VPHSUBSW xmm3/m128, xmm2, xmm1","vphsubsw xmm3/m128, xmm2, xmm1","VEX.128.66.0F38.WIG 07 /r","V","V","AVX","","","","","Subtract 16-bit signed integer horizontally, pack saturated integers to xmm1."
"VPHSUBSW ymm1, ymm2, ymm3/m256","VPHSUBSW ymm3/m256, ymm2, ymm1","vphsubsw ymm3/m256, ymm2, ymm1","VEX.256.66.0F38.WIG 07 /r","V","V","AVX2","","","","","Subtract 16-bit signed integer horizontally, pack saturated integers to ymm1."
"VPHSUBW xmm1, xmm2, xmm3/m128","VPHSUBW xmm3/m128, xmm2, xmm1","vphsubw xmm3/m128, xmm2, xmm1","VEX.128.66.0F38.WIG 05 /r","V","V","AVX","","","","","Subtract 16-bit signed integers horizontally, pack to xmm1."
"VPHSUBW ymm1, ymm2, ymm3/m256","VPHSUBW ymm3/m256, ymm2, ymm1","vphsubw ymm3/m256, ymm2, ymm1","VEX.256.66.0F38.WIG 05 /r","V","V","AVX2","","","","","Subtract 16-bit signed integers horizontally, pack to ymm1."
"VPINSRB xmm1, xmm2, r32/m8, imm8","VPINSRB imm8, r32/m8, xmm2, xmm1","vpinsrb imm8, r32/m8, xmm2, xmm1","EVEX.128.66.0F3A.WIG 20 /r ib","V","V","AVX512BW","","","Y","","Merge a byte integer value from r32/m8 and rest from xmm2 into xmm1 at the byte offset in imm8."
"VPINSRB xmm1, xmm2, r32/m8, imm8","VPINSRB imm8, r32/m8, xmm2, xmm1","vpinsrb imm8, r32/m8, xmm2, xmm1","VEX.128.66.0F3A.W0 20 /r ib","V","V","AVX","","","Y","","Merge a byte integer value from r32/m8 and rest from xmm2 into xmm1 at the byte offset in imm8."
"VPINSRD xmm1, xmm2, r/m32, imm8","VPINSRDL imm8, r/m32, xmm2, xmm1","vpinsrdl imm8, r/m32, xmm2, xmm1","EVEX.128.66.0F3A.W0 22 /r ib","V","V","AVX512DQ","","","Y","32","Insert a dword integer value from r32/m32 and rest from xmm2 into xmm1 at the dword offset in imm8."
"VPINSRD xmm1, xmm2, r/m32, imm8","VPINSRDL imm8, r/m32, xmm2, xmm1","vpinsrdl imm8, r/m32, xmm2, xmm1","VEX.128.66.0F3A.W0 22 /r ib","V","V","AVX","","","Y","32","Insert a dword integer value from r32/m32 and rest from xmm2 into xmm1 at the dword offset in imm8."
"VPINSRQ xmm1, xmm2, r/m64, imm8","VPINSRQQ imm8, r/m64, xmm2, xmm1","vpinsrqq imm8, r/m64, xmm2, xmm1","EVEX.128.66.0F3A.W1 22 /r ib","N.E.","V","AVX512DQ","","","Y","64","Insert a qword integer value from r64/m64 and rest from xmm2 into xmm1 at the qword offset in imm8."
"VPINSRQ xmm1, xmm2, r/m64, imm8","VPINSRQQ imm8, r/m64, xmm2, xmm1","vpinsrqq imm8, r/m64, xmm2, xmm1","VEX.128.66.0F3A.W1 22 /r ib","I","V","AVX","","","Y","64","Insert a qword integer value from r64/m64 and rest from xmm2 into xmm1 at the qword offset in imm8."
"VPINSRW xmm1, xmm2, r32/m16, imm8","VPINSRW imm8, r32/m16, xmm2, xmm1","vpinsrw imm8, r32/m16, xmm2, xmm1","EVEX.128.66.0F.WIG C4 /r ib","V","V","AVX512BW","","","Y","","Insert the word from r32/m16 at the offset indicated by imm8 into the value from xmm2 and store result in xmm1."
"VPINSRW xmm1, xmm2, r32/m16, imm8","VPINSRW imm8, r32/m16, xmm2, xmm1","vpinsrw imm8, r32/m16, xmm2, xmm1","VEX.128.66.0F.W0 C4 /r ib","V","V","AVX","","","Y","","Insert the word from r32/m16 at the offset indicated by imm8 into the value from xmm2 and store result in xmm1."
"VPMADDUBSW xmm1 {k1}{z}, xmm2, xmm3/m128","VPMADDUBSW xmm3/m128, xmm2, xmm1 {k1}{z}","vpmaddubsw xmm3/m128, xmm2, xmm1 {k1}{z}","EVEX.128.66.0F38.WIG 04 /r","V","V","AVX512VL AVX512BW","","","","","Multiply signed and unsigned bytes, add horizontal pair of signed words, pack saturated signed-words to xmm1 under writemask k1."
"VPMADDUBSW xmm1, xmm2, xmm3/m128","VPMADDUBSW xmm3/m128, xmm2, xmm1","vpmaddubsw xmm3/m128, xmm2, xmm1","VEX.128.66.0F38.WIG 04 /r","V","V","AVX","","","","","Multiply signed and unsigned bytes, add horizontal pair of signed words, pack saturated signed-words to xmm1."
"VPMADDUBSW ymm1 {k1}{z}, ymm2, ymm3/m256","VPMADDUBSW ymm3/m256, ymm2, ymm1 {k1}{z}","vpmaddubsw ymm3/m256, ymm2, ymm1 {k1}{z}","EVEX.256.66.0F38.WIG 04 /r","V","V","AVX512VL AVX512BW","","","","","Multiply signed and unsigned bytes, add horizontal pair of signed words, pack saturated signed-words to ymm1 under writemask k1."
"VPMADDUBSW ymm1, ymm2, ymm3/m256","VPMADDUBSW ymm3/m256, ymm2, ymm1","vpmaddubsw ymm3/m256, ymm2, ymm1","VEX.256.66.0F38.WIG 04 /r","V","V","AVX2","","","","","Multiply signed and unsigned bytes, add horizontal pair of signed words, pack saturated signed-words to ymm1."
"VPMADDUBSW zmm1 {k1}{z}, zmm2, zmm3/m512","VPMADDUBSW zmm3/m512, zmm2, zmm1 {k1}{z}","vpmaddubsw zmm3/m512, zmm2, zmm1 {k1}{z}","EVEX.512.66.0F38.WIG 04 /r","V","V","AVX512BW","","","","","Multiply signed and unsigned bytes, add horizontal pair of signed words, pack saturated signed-words to zmm1 under writemask k1."
"VPMADDWD xmm1 {k1}{z}, xmm2, xmm3/m128","VPMADDWD xmm3/m128, xmm2, xmm1 {k1}{z}","vpmaddwd xmm3/m128, xmm2, xmm1 {k1}{z}","EVEX.128.66.0F.WIG F5 /r","V","V","AVX512VL AVX512BW","","","","","Multiply the packed word integers in xmm2 by the packed word integers in xmm3/m128, add adjacent doubleword results, and store in xmm1 under writemask k1."
"VPMADDWD xmm1, xmm2, xmm3/m128","VPMADDWD xmm3/m128, xmm2, xmm1","vpmaddwd xmm3/m128, xmm2, xmm1","VEX.128.66.0F.WIG F5 /r","V","V","AVX","","","","","Multiply the packed word integers in xmm2 by the packed word integers in xmm3/m128, add adjacent doubleword results, and store in xmm1."
"VPMADDWD ymm1 {k1}{z}, ymm2, ymm3/m256","VPMADDWD ymm3/m256, ymm2, ymm1 {k1}{z}","vpmaddwd ymm3/m256, ymm2, ymm1 {k1}{z}","EVEX.256.66.0F.WIG F5 /r","V","V","AVX512VL AVX512BW","","","","","Multiply the packed word integers in ymm2 by the packed word integers in ymm3/m256, add adjacent doubleword results, and store in ymm1 under writemask k1."
"VPMADDWD ymm1, ymm2, ymm3/m256","VPMADDWD ymm3/m256, ymm2, ymm1","vpmaddwd ymm3/m256, ymm2, ymm1","VEX.256.66.0F.WIG F5 /r","V","V","AVX2","","","","","Multiply the packed word integers in ymm2 by the packed word integers in ymm3/m256, add adjacent doubleword results, and store in ymm1."
"VPMADDWD zmm1 {k1}{z}, zmm2, zmm3/m512","VPMADDWD zmm3/m512, zmm2, zmm1 {k1}{z}","vpmaddwd zmm3/m512, zmm2, zmm1 {k1}{z}","EVEX.512.66.0F.WIG F5 /r","V","V","AVX512BW","","","","","Multiply the packed word integers in zmm2 by the packed word integers in zmm3/m512, add adjacent doubleword results, and store in zmm1 under writemask k1."
"VPMAXSB xmm1, xmm2, xmm3/m128","VPMAXSB xmm3/m128, xmm2, xmm1","vpmaxsb xmm3/m128, xmm2, xmm1","VEX.128.66.0F38.WIG 3C /r","V","V","AVX","","","","","Compare packed signed byte integers in xmm2 and xmm3/m128 and store packed maximum values in xmm1."
"VPMAXSB xmm1{k1}{z}, xmm2, xmm3/m128","VPMAXSB xmm3/m128, xmm2, xmm1{k1}{z}","vpmaxsb xmm3/m128, xmm2, xmm1{k1}{z}","EVEX.128.66.0F38.WIG 3C /r","V","V","AVX512VL AVX512BW","","","","","Compare packed signed byte integers in xmm2 and xmm3/m128 and store packed maximum values in xmm1 under writemask k1."
"VPMAXSB ymm1, ymm2, ymm3/m256","VPMAXSB ymm3/m256, ymm2, ymm1","vpmaxsb ymm3/m256, ymm2, ymm1","VEX.256.66.0F38.WIG 3C /r","V","V","AVX2","","","","","Compare packed signed byte integers in ymm2 and ymm3/m256 and store packed maximum values in ymm1."
"VPMAXSB ymm1{k1}{z}, ymm2, ymm3/m256","VPMAXSB ymm3/m256, ymm2, ymm1{k1}{z}","vpmaxsb ymm3/m256, ymm2, ymm1{k1}{z}","EVEX.256.66.0F38.WIG 3C /r","V","V","AVX512VL AVX512BW","","","","","Compare packed signed byte integers in ymm2 and ymm3/m256 and store packed maximum values in ymm1 under writemask k1."
"VPMAXSB zmm1{k1}{z}, zmm2, zmm3/m512","VPMAXSB zmm3/m512, zmm2, zmm1{k1}{z}","vpmaxsb zmm3/m512, zmm2, zmm1{k1}{z}","EVEX.512.66.0F38.WIG 3C /r","V","V","AVX512BW","","","","","Compare packed signed byte integers in zmm2 and zmm3/m512 and store packed maximum values in zmm1 under writemask k1."
"VPMAXSD xmm1 {k1}{z}, xmm2, xmm3/m128/m32bcst","VPMAXSD xmm3/m128/m32bcst, xmm2, xmm1 {k1}{z}","vpmaxsd xmm3/m128/m32bcst, xmm2, xmm1 {k1}{z}","EVEX.128.66.0F38.W0 3D /r","V","V","AVX512VL AVX512F","","","","","Compare packed signed dword integers in xmm2 and xmm3/m128/m32bcst and store packed maximum values in xmm1 using writemask k1."
"VPMAXSD xmm1, xmm2, xmm3/m128","VPMAXSD xmm3/m128, xmm2, xmm1","vpmaxsd xmm3/m128, xmm2, xmm1","VEX.128.66.0F38.WIG 3D /r","V","V","AVX","","","","","Compare packed signed dword integers in xmm2 and xmm3/m128 and store packed maximum values in xmm1."
"VPMAXSD ymm1 {k1}{z}, ymm2, ymm3/m256/m32bcst","VPMAXSD ymm3/m256/m32bcst, ymm2, ymm1 {k1}{z}","vpmaxsd ymm3/m256/m32bcst, ymm2, ymm1 {k1}{z}","EVEX.256.66.0F38.W0 3D /r","V","V","AVX512VL AVX512F","","","","","Compare packed signed dword integers in ymm2 and ymm3/m256/m32bcst and store packed maximum values in ymm1 using writemask k1."
"VPMAXSD ymm1, ymm2, ymm3/m256","VPMAXSD ymm3/m256, ymm2, ymm1","vpmaxsd ymm3/m256, ymm2, ymm1","VEX.256.66.0F38.WIG 3D /r","V","V","AVX2","","","","","Compare packed signed dword integers in ymm2 and ymm3/m256 and store packed maximum values in ymm1."
"VPMAXSD zmm1 {k1}{z}, zmm2, zmm3/m512/m32bcst","VPMAXSD zmm3/m512/m32bcst, zmm2, zmm1 {k1}{z}","vpmaxsd zmm3/m512/m32bcst, zmm2, zmm1 {k1}{z}","EVEX.512.66.0F38.W0 3D /r","V","V","AVX512F","","","","","Compare packed signed dword integers in zmm2 and zmm3/m512/m32bcst and store packed maximum values in zmm1 using writemask k1."
"VPMAXSQ xmm1 {k1}{z}, xmm2, xmm3/m128/m64bcst","VPMAXSQ xmm3/m128/m64bcst, xmm2, xmm1 {k1}{z}","vpmaxsq xmm3/m128/m64bcst, xmm2, xmm1 {k1}{z}","EVEX.128.66.0F38.W1 3D /r","V","V","AVX512VL AVX512F","","","","","Compare packed signed qword integers in xmm2 and xmm3/m128/m64bcst and store packed maximum values in xmm1 using writemask k1."
"VPMAXSQ ymm1 {k1}{z}, ymm2, ymm3/m256/m64bcst","VPMAXSQ ymm3/m256/m64bcst, ymm2, ymm1 {k1}{z}","vpmaxsq ymm3/m256/m64bcst, ymm2, ymm1 {k1}{z}","EVEX.256.66.0F38.W1 3D /r","V","V","AVX512VL AVX512F","","","","","Compare packed signed qword integers in ymm2 and ymm3/m256/m64bcst and store packed maximum values in ymm1 using writemask k1."
"VPMAXSQ zmm1 {k1}{z}, zmm2, zmm3/m512/m64bcst","VPMAXSQ zmm3/m512/m64bcst, zmm2, zmm1 {k1}{z}","vpmaxsq zmm3/m512/m64bcst, zmm2, zmm1 {k1}{z}","EVEX.512.66.0F38.W1 3D /r","V","V","AVX512F","","","","","Compare packed signed qword integers in zmm2 and zmm3/m512/m64bcst and store packed maximum values in zmm1 using writemask k1."
"VPMAXSW xmm1, xmm2, xmm3/m128","VPMAXSW xmm3/m128, xmm2, xmm1","vpmaxsw xmm3/m128, xmm2, xmm1","VEX.128.66.0F.WIG EE /r","V","V","AVX","","","","","Compare packed signed word integers in xmm3/m128 and xmm2 and store packed maximum values in xmm1."
"VPMAXSW xmm1{k1}{z}, xmm2, xmm3/m128","VPMAXSW xmm3/m128, xmm2, xmm1{k1}{z}","vpmaxsw xmm3/m128, xmm2, xmm1{k1}{z}","EVEX.128.66.0F.WIG EE /r","V","V","AVX512VL AVX512BW","","","","","Compare packed signed word integers in xmm2 and xmm3/m128 and store packed maximum values in xmm1 under writemask k1."
"VPMAXSW ymm1, ymm2, ymm3/m256","VPMAXSW ymm3/m256, ymm2, ymm1","vpmaxsw ymm3/m256, ymm2, ymm1","VEX.256.66.0F.WIG EE /r","V","V","AVX2","","","","","Compare packed signed word integers in ymm3/m256 and ymm2 and store packed maximum values in ymm1."
"VPMAXSW ymm1{k1}{z}, ymm2, ymm3/m256","VPMAXSW ymm3/m256, ymm2, ymm1{k1}{z}","vpmaxsw ymm3/m256, ymm2, ymm1{k1}{z}","EVEX.256.66.0F.WIG EE /r","V","V","AVX512VL AVX512BW","","","","","Compare packed signed word integers in ymm2 and ymm3/m256 and store packed maximum values in ymm1 under writemask k1."
"VPMAXSW zmm1{k1}{z}, zmm2, zmm3/m512","VPMAXSW zmm3/m512, zmm2, zmm1{k1}{z}","vpmaxsw zmm3/m512, zmm2, zmm1{k1}{z}","EVEX.512.66.0F.WIG EE /r","V","V","AVX512BW","","","","","Compare packed signed word integers in zmm2 and zmm3/m512 and store packed maximum values in zmm1 under writemask k1."
"VPMAXUB xmm1, xmm2, xmm3/m128","VPMAXUB xmm3/m128, xmm2, xmm1","vpmaxub xmm3/m128, xmm2, xmm1","VEX.128.66.0F DE /r","V","V","AVX","","","","","Compare packed unsigned byte integers in xmm2 and xmm3/m128 and store packed maximum values in xmm1."
"VPMAXUB xmm1{k1}{z}, xmm2, xmm3/m128","VPMAXUB xmm3/m128, xmm2, xmm1{k1}{z}","vpmaxub xmm3/m128, xmm2, xmm1{k1}{z}","EVEX.128.66.0F.WIG DE /r","V","V","AVX512VL AVX512BW","","","","","Compare packed unsigned byte integers in xmm2 and xmm3/m128 and store packed maximum values in xmm1 under writemask k1."
"VPMAXUB ymm1, ymm2, ymm3/m256","VPMAXUB ymm3/m256, ymm2, ymm1","vpmaxub ymm3/m256, ymm2, ymm1","VEX.256.66.0F DE /r","V","V","AVX2","","","","","Compare packed unsigned byte integers in ymm2 and ymm3/m256 and store packed maximum values in ymm1."
"VPMAXUB ymm1{k1}{z}, ymm2, ymm3/m256","VPMAXUB ymm3/m256, ymm2, ymm1{k1}{z}","vpmaxub ymm3/m256, ymm2, ymm1{k1}{z}","EVEX.256.66.0F.WIG DE /r","V","V","AVX512VL AVX512BW","","","","","Compare packed unsigned byte integers in ymm2 and ymm3/m256 and store packed maximum values in ymm1 under writemask k1."
"VPMAXUB zmm1{k1}{z}, zmm2, zmm3/m512","VPMAXUB zmm3/m512, zmm2, zmm1{k1}{z}","vpmaxub zmm3/m512, zmm2, zmm1{k1}{z}","EVEX.512.66.0F.WIG DE /r","V","V","AVX512BW","","","","","Compare packed unsigned byte integers in zmm2 and zmm3/m512 and store packed maximum values in zmm1 under writemask k1."
"VPMAXUW xmm1, xmm2, xmm3/m128","VPMAXUW xmm3/m128, xmm2, xmm1","vpmaxuw xmm3/m128, xmm2, xmm1","VEX.128.66.0F38 3E /r","V","V","AVX","","","","","Compare packed unsigned word integers in xmm3/m128 and xmm2 and store maximum packed values in xmm1."
"VPMAXUW xmm1{k1}{z}, xmm2, xmm3/m128","VPMAXUW xmm3/m128, xmm2, xmm1{k1}{z}","vpmaxuw xmm3/m128, xmm2, xmm1{k1}{z}","EVEX.128.66.0F38.WIG 3E /r","V","V","AVX512VL AVX512BW","","","","","Compare packed unsigned word integers in xmm2 and xmm3/m128 and store packed maximum values in xmm1 under writemask k1."
"VPMAXUW ymm1, ymm2, ymm3/m256","VPMAXUW ymm3/m256, ymm2, ymm1","vpmaxuw ymm3/m256, ymm2, ymm1","VEX.256.66.0F38 3E /r","V","V","AVX2","","","","","Compare packed unsigned word integers in ymm3/m256 and ymm2 and store maximum packed values in ymm1."
"VPMAXUW ymm1{k1}{z}, ymm2, ymm3/m256","VPMAXUW ymm3/m256, ymm2, ymm1{k1}{z}","vpmaxuw ymm3/m256, ymm2, ymm1{k1}{z}","EVEX.256.66.0F38.WIG 3E /r","V","V","AVX512VL AVX512BW","","","","","Compare packed unsigned word integers in ymm2 and ymm3/m256 and store packed maximum values in ymm1 under writemask k1."
"VPMAXUW zmm1{k1}{z}, zmm2, zmm3/m512","VPMAXUW zmm3/m512, zmm2, zmm1{k1}{z}","vpmaxuw zmm3/m512, zmm2, zmm1{k1}{z}","EVEX.512.66.0F38.WIG 3E /r","V","V","AVX512BW","","","","","Compare packed unsigned word integers in zmm2 and zmm3/m512 and store packed maximum values in zmm1 under writemask k1."
"VPMINSB xmm1, xmm2, xmm3/m128","VPMINSB xmm3/m128, xmm2, xmm1","vpminsb xmm3/m128, xmm2, xmm1","VEX.128.66.0F38 38 /r","V","V","AVX","","","","","Compare packed signed byte integers in xmm2 and xmm3/m128 and store packed minimum values in xmm1."
"VPMINSB xmm1{k1}{z}, xmm2, xmm3/m128","VPMINSB xmm3/m128, xmm2, xmm1{k1}{z}","vpminsb xmm3/m128, xmm2, xmm1{k1}{z}","EVEX.128.66.0F38.WIG 38 /r","V","V","AVX512VL AVX512BW","","","","","Compare packed signed byte integers in xmm2 and xmm3/m128 and store packed minimum values in xmm1 under writemask k1."
"VPMINSB ymm1, ymm2, ymm3/m256","VPMINSB ymm3/m256, ymm2, ymm1","vpminsb ymm3/m256, ymm2, ymm1","VEX.256.66.0F38 38 /r","V","V","AVX2","","","","","Compare packed signed byte integers in ymm2 and ymm3/m256 and store packed minimum values in ymm1."
"VPMINSB ymm1{k1}{z}, ymm2, ymm3/m256","VPMINSB ymm3/m256, ymm2, ymm1{k1}{z}","vpminsb ymm3/m256, ymm2, ymm1{k1}{z}","EVEX.256.66.0F38.WIG 38 /r","V","V","AVX512VL AVX512BW","","","","","Compare packed signed byte integers in ymm2 and ymm3/m256 and store packed minimum values in ymm1 under writemask k1."
"VPMINSB zmm1{k1}{z}, zmm2, zmm3/m512","VPMINSB zmm3/m512, zmm2, zmm1{k1}{z}","vpminsb zmm3/m512, zmm2, zmm1{k1}{z}","EVEX.512.66.0F38.WIG 38 /r","V","V","AVX512BW","","","","","Compare packed signed byte integers in zmm2 and zmm3/m512 and store packed minimum values in zmm1 under writemask k1."
"VPMINSW xmm1, xmm2, xmm3/m128","VPMINSW xmm3/m128, xmm2, xmm1","vpminsw xmm3/m128, xmm2, xmm1","VEX.128.66.0F EA /r","V","V","AVX","","","","","Compare packed signed word integers in xmm3/m128 and xmm2 and return packed minimum values in xmm1."
"VPMINSW xmm1{k1}{z}, xmm2, xmm3/m128","VPMINSW xmm3/m128, xmm2, xmm1{k1}{z}","vpminsw xmm3/m128, xmm2, xmm1{k1}{z}","EVEX.128.66.0F.WIG EA /r","V","V","AVX512VL AVX512BW","","","","","Compare packed signed word integers in xmm2 and xmm3/m128 and store packed minimum values in xmm1 under writemask k1."
"VPMINSW ymm1, ymm2, ymm3/m256","VPMINSW ymm3/m256, ymm2, ymm1","vpminsw ymm3/m256, ymm2, ymm1","VEX.256.66.0F EA /r","V","V","AVX2","","","","","Compare packed signed word integers in ymm3/m256 and ymm2 and return packed minimum values in ymm1."
"VPMINSW ymm1{k1}{z}, ymm2, ymm3/m256","VPMINSW ymm3/m256, ymm2, ymm1{k1}{z}","vpminsw ymm3/m256, ymm2, ymm1{k1}{z}","EVEX.256.66.0F.WIG EA /r","V","V","AVX512VL AVX512BW","","","","","Compare packed signed word integers in ymm2 and ymm3/m256 and store packed minimum values in ymm1 under writemask k1."
"VPMINSW zmm1{k1}{z}, zmm2, zmm3/m512","VPMINSW zmm3/m512, zmm2, zmm1{k1}{z}","vpminsw zmm3/m512, zmm2, zmm1{k1}{z}","EVEX.512.66.0F.WIG EA /r","V","V","AVX512BW","","","","","Compare packed signed word integers in zmm2 and zmm3/m512 and store packed minimum values in zmm1 under writemask k1."
"VPMINUB xmm1 {k1}{z}, xmm2, xmm3/m128","VPMINUB xmm3/m128, xmm2, xmm1 {k1}{z}","vpminub xmm3/m128, xmm2, xmm1 {k1}{z}","EVEX.128.66.0F DA /r","V","V","AVX512VL AVX512BW","","","","","Compare packed unsigned byte integers in xmm2 and xmm3/m128 and store packed minimum values in xmm1 under writemask k1."
"VPMINUB xmm1, xmm2, xmm3/m128","VPMINUB xmm3/m128, xmm2, xmm1","vpminub xmm3/m128, xmm2, xmm1","VEX.128.66.0F DA /r","V","V","AVX","","","","","Compare packed unsigned byte integers in xmm2 and xmm3/m128 and store packed minimum values in xmm1."
"VPMINUB ymm1 {k1}{z}, ymm2, ymm3/m256","VPMINUB ymm3/m256, ymm2, ymm1 {k1}{z}","vpminub ymm3/m256, ymm2, ymm1 {k1}{z}","EVEX.256.66.0F DA /r","V","V","AVX512VL AVX512BW","","","","","Compare packed unsigned byte integers in ymm2 and ymm3/m256 and store packed minimum values in ymm1 under writemask k1."
"VPMINUB ymm1, ymm2, ymm3/m256","VPMINUB ymm3/m256, ymm2, ymm1","vpminub ymm3/m256, ymm2, ymm1","VEX.256.66.0F DA /r","V","V","AVX2","","","","","Compare packed unsigned byte integers in ymm2 and ymm3/m256 and store packed minimum values in ymm1."
"VPMINUB zmm1 {k1}{z}, zmm2, zmm3/m512","VPMINUB zmm3/m512, zmm2, zmm1 {k1}{z}","vpminub zmm3/m512, zmm2, zmm1 {k1}{z}","EVEX.512.66.0F DA /r","V","V","AVX512BW","","","","","Compare packed unsigned byte integers in zmm2 and zmm3/m512 and store packed minimum values in zmm1 under writemask k1."
"VPMINUD xmm1 {k1}{z}, xmm2, xmm3/m128/m32bcst","VPMINUD xmm3/m128/m32bcst, xmm2, xmm1 {k1}{z}","vpminud xmm3/m128/m32bcst, xmm2, xmm1 {k1}{z}","EVEX.128.66.0F38.W0 3B /r","V","V","AVX512VL AVX512F","","","","","Compare packed unsigned dword integers in xmm2 and xmm3/m128/m32bcst and store packed minimum values in xmm1 under writemask k1."
"VPMINUD xmm1, xmm2, xmm3/m128","VPMINUD xmm3/m128, xmm2, xmm1","vpminud xmm3/m128, xmm2, xmm1","VEX.128.66.0F38.WIG 3B /r","V","V","AVX","","","","","Compare packed unsigned dword integers in xmm2 and xmm3/m128 and store packed minimum values in xmm1."
