# x86 instruction set description version 0.2, 2023-03-05
"SUB r/m32, imm8","SUBL imm8, r/m32","subl imm8, r/m32","83 /5 ib","V","V","","operand32","","Y","32","Subtract sign-extended imm8 from r/m32."
"SUB r/m32, r32","SUBL r32, r/m32","subl r32, r/m32","29 /r","V","V","","operand32","","Y","32","Subtract r32 from r/m32."
"SUB r/m64, imm32","SUBQ imm32, r/m64","subq imm32, r/m64","REX.W 81 /5 id","N.E.","V","","","","Y","64","Subtract imm32 sign-extended to 64-bits from r/m64."
"SUB r/m64, imm8","SUBQ imm8, r/m64","subq imm8, r/m64","REX.W 83 /5 ib","N.E.","V","","","","Y","64","Subtract sign-extended imm8 from r/m64."
"SUB r/m64, r64","SUBQ r64, r/m64","subq r64, r/m64","REX.W 29 /r","N.E.","V","","","","Y","64","Subtract r64 from r/m64."
"SUB r/m8, imm8","SUBB imm8, r/m8","subb imm8, r/m8","80 /5 ib","V","V","","","","Y","8","Subtract imm8 from r/m8."
"SUB r/m8, imm8","SUBB imm8, r/m8","subb imm8, r/m8","REX 80 /5 ib","N.E.","V","","pseudo64","","Y","8","Subtract imm8 from r/m8."
"SUB r/m8, r8","SUBB r8, r/m8","subb r8, r/m8","28 /r","V","V","","","","Y","8","Subtract r8 from r/m8."
"SUB r/m8, r8","SUBB r8, r/m8","subb r8, r/m8","REX 28 /r","N.E.","V","","pseudo64","","Y","8","Subtract r8 from r/m8."
"SUB r16, r/m16","SUBW r/m16, r16","subw r/m16, r16","2B /r","V","V","","operand16","","Y","16","Subtract r/m16 from r16."
"SUB r32, r/m32","SUBL r/m32, r32","subl r/m32, r32","2B /r","V","V","","operand32","","Y","32","Subtract r/m32 from r32."
"SUB r64, r/m64","SUBQ r/m64, r64","subq r/m64, r64","REX.W 2B /r","N.E.","V","","","","Y","64","Subtract r/m64 from r64."
"SUB r8, r/m8","SUBB r/m8, r8","subb r/m8, r8","2A /r","V","V","","","","Y","8","Subtract r/m8 from r8."
"SUB r8, r/m8","SUBB r/m8, r8","subb r/m8, r8","REX 2A /r","N.E.","V","","pseudo64","","Y","8","Subtract r/m8 from r8."
"SUBPD xmm1, xmm2/m128","SUBPD xmm2/m128, xmm1","subpd xmm2/m128, xmm1","66 0F 5C /r","V","V","SSE2","","","","","Subtract packed double precision floating-point values in xmm2/mem from xmm1 and store result in xmm1."
"SUBPS xmm1, xmm2/m128","SUBPS xmm2/m128, xmm1","subps xmm2/m128, xmm1","NP 0F 5C /r","V","V","SSE","","","","","Subtract packed single precision floating-point values in xmm2/mem from xmm1 and store result in xmm1."
"SUBSD xmm1, xmm2/m64","SUBSD xmm2/m64, xmm1","subsd xmm2/m64, xmm1","F2 0F 5C /r","V","V","SSE2","","","","","Subtract the low double precision floating-point value in xmm2/m64 from xmm1 and store the result in xmm1."
"SUBSS xmm1, xmm2/m32","SUBSS xmm2/m32, xmm1","subss xmm2/m32, xmm1","F3 0F 5C /r","V","V","SSE","","","","","Subtract the low single precision floating-point value in xmm2/m32 from xmm1 and store the result in xmm1."
"SWAPGS","SWAPGS","swapgs","0F 01 F8","I","V","","","","","","Exchanges the current GS base register value with the value contained in MSR address C0000102H."
"SYSCALL","SYSCALL","syscall","0F 05","I","V","","","","","","Fast call to privilege level 0 system procedures."
"SYSENTER","SYSENTER","sysenter","0F 34","V","V","PentiumII","","","","","Fast call to privilege level 0 system procedures."
"SYSEXIT","SYSEXIT","sysexit","0F 35","V","V","PentiumII","ignoreREXW","","","","Fast return to privilege level 3 user code."
"SYSEXIT","SYSEXIT","sysexit","REX.W 0F 35","N.E.","V","","pseudo","","","","Fast return to 64-bit mode privilege level 3 user code."
"SYSRET","SYSRET","sysretw/sysretl/sysretl","0F 07","I","V","","ignoreREXW","","","","Return to compatibility mode from fast system call."
"SYSRET","SYSRET","sysretw/sysretl/sysretl","REX.W 0F 07","I","V","","pseudo","","","","Return to 64-bit mode from fast system call."
"TEST AL, imm8","TESTB imm8, AL","testb imm8, AL","A8 ib","V","V","","","","Y","8","AND imm8 with AL; set SF, ZF, PF according to result."
"TEST AX, imm16","TESTW imm16, AX","testw imm16, AX","A9 iw","V","V","","operand16","","Y","16","AND imm16 with AX; set SF, ZF, PF according to result."
"TEST EAX, imm32","TESTL imm32, EAX","testl imm32, EAX","A9 id","V","V","","operand32","","Y","32","AND imm32 with EAX; set SF, ZF, PF according to result."
"TEST RAX, imm32","TESTQ imm32, RAX","testq imm32, RAX","REX.W A9 id","N.E.","V","","","","Y","64","AND imm32 sign-extended to 64-bits with RAX; set SF, ZF, PF according to result."
"TEST r/m16, imm16","TESTW imm16, r/m16","testw imm16, r/m16","F7 /0 iw","V","V","","operand16","","Y","16","AND imm16 with r/m16; set SF, ZF, PF according to result."
"TEST r/m16, r16","TESTW r16, r/m16","testw r16, r/m16","85 /r","V","V","","operand16","","Y","16","AND r16 with r/m16; set SF, ZF, PF according to result."
"TEST r/m32, imm32","TESTL imm32, r/m32","testl imm32, r/m32","F7 /0 id","V","V","","operand32","","Y","32","AND imm32 with r/m32; set SF, ZF, PF according to result."
"TEST r/m32, r32","TESTL r32, r/m32","testl r32, r/m32","85 /r","V","V","","operand32","","Y","32","AND r32 with r/m32; set SF, ZF, PF according to result."
"TEST r/m64, imm32","TESTQ imm32, r/m64","testq imm32, r/m64","REX.W F7 /0 id","N.E.","V","","","","Y","64","AND imm32 sign-extended to 64-bits with r/m64; set SF, ZF, PF according to result."
"TEST r/m64, r64","TESTQ r64, r/m64","testq r64, r/m64","REX.W 85 /r","N.E.","V","","","","Y","64","AND r64 with r/m64; set SF, ZF, PF according to result."
"TEST r/m8, imm8","TESTB imm8, r/m8","testb imm8, r/m8","F6 /0 ib","V","V","","","","Y","8","AND imm8 with r/m8; set SF, ZF, PF according to result."
"TEST r/m8, imm8","TESTB imm8, r/m8","testb imm8, r/m8","REX F6 /0 ib","N.E.","V","","pseudo64","","Y","8","AND imm8 with r/m8; set SF, ZF, PF according to result."
"TEST r/m8, r8","TESTB r8, r/m8","testb r8, r/m8","84 /r","V","V","","","","Y","8","AND r8 with r/m8; set SF, ZF, PF according to result."
"TEST r/m8, r8","TESTB r8, r/m8","testb r8, r/m8","REX 84 /r","N.E.","V","","pseudo64","","Y","8","AND r8 with r/m8; set SF, ZF, PF according to result."
"TZCNT r16, r/m16","TZCNTW r/m16, r16","tzcntw r/m16, r16","F3 0F BC /r","V","V","BMI1","operand16","","Y","16","Count the number of trailing zero bits in r/m16, return result in r16."
"TZCNT r32, r/m32","TZCNTL r/m32, r32","tzcntl r/m32, r32","F3 0F BC /r","V","V","BMI1","operand32","","Y","32","Count the number of trailing zero bits in r/m32, return result in r32."
"TZCNT r64, r/m64","TZCNTQ r/m64, r64","tzcntq r/m64, r64","F3 REX.W 0F BC /r","N.E.","V","BMI1","","","Y","64","Count the number of trailing zero bits in r/m64, return result in r64."
"UCOMISD xmm1, xmm2/m64","UCOMISD xmm2/m64, xmm1","ucomisd xmm2/m64, xmm1","66 0F 2E /r","V","V","SSE2","","","","","Compare low double precision floating-point values in xmm1 and xmm2/mem64 and set the EFLAGS flags accordingly."
"UCOMISS xmm1, xmm2/m32","UCOMISS xmm2/m32, xmm1","ucomiss xmm2/m32, xmm1","NP 0F 2E /r","V","V","SSE","","","","","Compare low single precision floating-point values in xmm1 and xmm2/mem32 and set the EFLAGS flags accordingly."
"UD0 r32, r/m32","UD0 r/m32, r32","ud0 r/m32, r32","0F FF /r","V","V","","","","","","Raise invalid opcode exception."
"UD1","UD1","ud1","0F B9","V","V","","","","","",""
"UD1 r32, r/m32","UD1 r/m32, r32","ud1 r/m32, r32","0F B9 /r","V","V","","","","","","Raise invalid opcode exception."
"UD2","UD2","ud2","0F 0B","V","V","","","","","","Raise invalid opcode exception."
"UNPCKHPD xmm1, xmm2/m128","UNPCKHPD xmm2/m128, xmm1","unpckhpd xmm2/m128, xmm1","66 0F 15 /r","V","V","SSE2","","","","","Unpacks and Interleaves double precision floating-point values from high quadwords of xmm1 and xmm2/m128."
"UNPCKHPS xmm1, xmm2/m128","UNPCKHPS xmm2/m128, xmm1","unpckhps xmm2/m128, xmm1","NP 0F 15 /r","V","V","SSE","","","","","Unpacks and Interleaves single precision floating-point values from high quadwords of xmm1 and xmm2/m128."
"UNPCKLPD xmm1, xmm2/m128","UNPCKLPD xmm2/m128, xmm1","unpcklpd xmm2/m128, xmm1","66 0F 14 /r","V","V","SSE2","","","","","Unpacks and Interleaves double precision floating-point values from low quadwords of xmm1 and xmm2/m128."
"UNPCKLPS xmm1, xmm2/m128","UNPCKLPS xmm2/m128, xmm1","unpcklps xmm2/m128, xmm1","NP 0F 14 /r","V","V","SSE","","","","","Unpacks and Interleaves single precision floating-point values from low quadwords of xmm1 and xmm2/m128."
"VADDPD xmm1 {k1}{z}, xmm2, xmm3/m128/m64bcst","VADDPD xmm3/m128/m64bcst, xmm2, xmm1 {k1}{z}","vaddpd xmm3/m128/m64bcst, xmm2, xmm1 {k1}{z}","EVEX.128.66.0F.W1 58 /r","V","V","AVX512VL AVX512F","","","","","Add packed double precision floating-point values from xmm3/m128/m64bcst to xmm2 and store result in xmm1 with writemask k1."
"VADDPD xmm1, xmm2, xmm3/m128","VADDPD xmm3/m128, xmm2, xmm1","vaddpd xmm3/m128, xmm2, xmm1","VEX.128.66.0F.WIG 58 /r","V","V","AVX","","","","","Add packed double precision floating-point values from xmm3/mem to xmm2 and store result in xmm1."
"VADDPD ymm1 {k1}{z}, ymm2, ymm3/m256/m64bcst","VADDPD ymm3/m256/m64bcst, ymm2, ymm1 {k1}{z}","vaddpd ymm3/m256/m64bcst, ymm2, ymm1 {k1}{z}","EVEX.256.66.0F.W1 58 /r","V","V","AVX512VL AVX512F","","","","","Add packed double precision floating-point values from ymm3/m256/m64bcst to ymm2 and store result in ymm1 with writemask k1."
"VADDPD ymm1, ymm2, ymm3/m256","VADDPD ymm3/m256, ymm2, ymm1","vaddpd ymm3/m256, ymm2, ymm1","VEX.256.66.0F.WIG 58 /r","V","V","AVX","","","","","Add packed double precision floating-point values from ymm3/mem to ymm2 and store result in ymm1."
"VADDPD zmm1 {k1}{z}, zmm2, zmm3/m512/m64bcst{er}","VADDPD zmm3/m512/m64bcst{er}, zmm2, zmm1 {k1}{z}","vaddpd zmm3/m512/m64bcst{er}, zmm2, zmm1 {k1}{z}","EVEX.512.66.0F.W1 58 /r","V","V","AVX512F","","","","","Add packed double precision floating-point values from zmm3/m512/m64bcst to zmm2 and store result in zmm1 with writemask k1."
"VADDPS xmm1 {k1}{z}, xmm2, xmm3/m128/m32bcst","VADDPS xmm3/m128/m32bcst, xmm2, xmm1 {k1}{z}","vaddps xmm3/m128/m32bcst, xmm2, xmm1 {k1}{z}","EVEX.128.0F.W0 58 /r","V","V","AVX512VL AVX512F","","","","","Add packed single precision floating-point values from xmm3/m128/m32bcst to xmm2 and store result in xmm1 with writemask k1."
"VADDPS xmm1, xmm2, xmm3/m128","VADDPS xmm3/m128, xmm2, xmm1","vaddps xmm3/m128, xmm2, xmm1","VEX.128.0F.WIG 58 /r","V","V","AVX","","","","","Add packed single precision floating-point values from xmm3/m128 to xmm2 and store result in xmm1."
"VADDPS ymm1 {k1}{z}, ymm2, ymm3/m256/m32bcst","VADDPS ymm3/m256/m32bcst, ymm2, ymm1 {k1}{z}","vaddps ymm3/m256/m32bcst, ymm2, ymm1 {k1}{z}","EVEX.256.0F.W0 58 /r","V","V","AVX512VL AVX512F","","","","","Add packed single precision floating-point values from ymm3/m256/m32bcst to ymm2 and store result in ymm1 with writemask k1."
"VADDPS ymm1, ymm2, ymm3/m256","VADDPS ymm3/m256, ymm2, ymm1","vaddps ymm3/m256, ymm2, ymm1","VEX.256.0F.WIG 58 /r","V","V","AVX","","","","","Add packed single precision floating-point values from ymm3/m256 to ymm2 and store result in ymm1."
"VADDPS zmm1 {k1}{z}, zmm2, zmm3/m512/m32bcst {er}","VADDPS zmm3/m512/m32bcst {er}, zmm2, zmm1 {k1}{z}","vaddps zmm3/m512/m32bcst {er}, zmm2, zmm1 {k1}{z}","EVEX.512.0F.W0 58 /r","V","V","AVX512F","","","","","Add packed single precision floating-point values from zmm3/m512/m32bcst to zmm2 and store result in zmm1 with writemask k1."
"VADDSD xmm1 {k1}{z}, xmm2, xmm3/m64{er}","VADDSD xmm3/m64{er}, xmm2, xmm1 {k1}{z}","vaddsd xmm3/m64{er}, xmm2, xmm1 {k1}{z}","EVEX.LLIG.F2.0F.W1 58 /r","V","V","AVX512F","","","","","Add the low double precision floating-point value from xmm3/m64 to xmm2 and store the result in xmm1 with writemask k1."
"VADDSD xmm1, xmm2, xmm3/m64","VADDSD xmm3/m64, xmm2, xmm1","vaddsd xmm3/m64, xmm2, xmm1","VEX.LIG.F2.0F.WIG 58 /r","V","V","AVX","","","","","Add the low double precision floating-point value from xmm3/mem to xmm2 and store the result in xmm1."
"VADDSS xmm1, xmm2, xmm3/m32","VADDSS xmm3/m32, xmm2, xmm1","vaddss xmm3/m32, xmm2, xmm1","VEX.LIG.F3.0F.WIG 58 /r","V","V","AVX","","","","","Add the low single precision floating-point value from xmm3/mem to xmm2 and store the result in xmm1."
"VADDSS xmm1{k1}{z}, xmm2, xmm3/m32{er}","VADDSS xmm3/m32{er}, xmm2, xmm1{k1}{z}","vaddss xmm3/m32{er}, xmm2, xmm1{k1}{z}","EVEX.LLIG.F3.0F.W0 58 /r","V","V","AVX512F","","","","","Add the low single precision floating-point value from xmm3/m32 to xmm2 and store the result in xmm1with writemask k1."
"VADDSUBPD xmm1, xmm2, xmm3/m128","VADDSUBPD xmm3/m128, xmm2, xmm1","vaddsubpd xmm3/m128, xmm2, xmm1","VEX.128.66.0F.WIG D0 /r","V","V","AVX","","","","","Add/subtract packed double precision floating-point values from xmm3/mem to xmm2 and stores result in xmm1."
"VADDSUBPD ymm1, ymm2, ymm3/m256","VADDSUBPD ymm3/m256, ymm2, ymm1","vaddsubpd ymm3/m256, ymm2, ymm1","VEX.256.66.0F.WIG D0 /r","V","V","AVX","","","","","Add / subtract packed double precision floating-point values from ymm3/mem to ymm2 and stores result in ymm1."
"VADDSUBPS xmm1, xmm2, xmm3/m128","VADDSUBPS xmm3/m128, xmm2, xmm1","vaddsubps xmm3/m128, xmm2, xmm1","VEX.128.F2.0F.WIG D0 /r","V","V","AVX","","","","","Add/subtract single precision floating-point values from xmm3/mem to xmm2 and stores result in xmm1."
"VADDSUBPS ymm1, ymm2, ymm3/m256","VADDSUBPS ymm3/m256, ymm2, ymm1","vaddsubps ymm3/m256, ymm2, ymm1","VEX.256.F2.0F.WIG D0 /r","V","V","AVX","","","","","Add / subtract single precision floating-point values from ymm3/mem to ymm2 and stores result in ymm1."
"VAESDEC xmm1, xmm2, xmm3/m128","VAESDEC xmm3/m128, xmm2, xmm1","vaesdec xmm3/m128, xmm2, xmm1","EVEX.128.66.0F38.WIG DE /r","V","V","VAES AVX512VL","","","Y","","Perform one round of an AES decryption flow, using the Equivalent Inverse Cipher, using one 128-bit data (state) from xmm2 with one 128-bit round key from xmm3/m128; store the result in xmm1."
"VAESDEC xmm1, xmm2, xmm3/m128","VAESDEC xmm3/m128, xmm2, xmm1","vaesdec xmm3/m128, xmm2, xmm1","VEX.128.66.0F38.WIG DE /r","V","V","AES AVX","","","Y","","Perform one round of an AES decryption flow, using the Equivalent Inverse Cipher, using one 128-bit data (state) from xmm2 with one 128-bit round key from xmm3/m128; store the result in xmm1."
"VAESDEC ymm1, ymm2, ymm3/m256","VAESDEC ymm3/m256, ymm2, ymm1","vaesdec ymm3/m256, ymm2, ymm1","EVEX.256.66.0F38.WIG DE /r","V","V","VAES AVX512VL","","","Y","","Perform one round of an AES decryption flow, using the Equivalent Inverse Cipher, using two 128-bit data (state) from ymm2 with two 128-bit round keys from ymm3/m256; store the result in ymm1."
"VAESDEC ymm1, ymm2, ymm3/m256","VAESDEC ymm3/m256, ymm2, ymm1","vaesdec ymm3/m256, ymm2, ymm1","VEX.256.66.0F38.WIG DE /r","V","V","VAES","","","Y","","Perform one round of an AES decryption flow, using the Equivalent Inverse Cipher, using two 128-bit data (state) from ymm2 with two 128-bit round keys from ymm3/m256; store the result in ymm1."
"VAESDEC zmm1, zmm2, zmm3/m512","VAESDEC zmm3/m512, zmm2, zmm1","vaesdec zmm3/m512, zmm2, zmm1","EVEX.512.66.0F38.WIG DE /r","V","V","VAES AVX512F","","","Y","","Perform one round of an AES decryption flow, using the Equivalent Inverse Cipher, using four 128-bit data (state) from zmm2 with four 128-bit round keys from zmm3/m512; store the result in zmm1."
"VAESDECLAST xmm1, xmm2, xmm3/m128","VAESDECLAST xmm3/m128, xmm2, xmm1","vaesdeclast xmm3/m128, xmm2, xmm1","EVEX.128.66.0F38.WIG DF /r","V","V","VAES AVX512VL","","","Y","","Perform the last round of an AES decryption flow, using the Equivalent Inverse Cipher, using one 128-bit data (state) from xmm2 with one 128-bit round key from xmm3/m128; store the result in xmm1."
"VAESDECLAST xmm1, xmm2, xmm3/m128","VAESDECLAST xmm3/m128, xmm2, xmm1","vaesdeclast xmm3/m128, xmm2, xmm1","VEX.128.66.0F38.WIG DF /r","V","V","AES AVX","","","Y","","Perform the last round of an AES decryption flow, using the Equivalent Inverse Cipher, using one 128-bit data (state) from xmm2 with one 128-bit round key from xmm3/m128; store the result in xmm1."
"VAESDECLAST ymm1, ymm2, ymm3/m256","VAESDECLAST ymm3/m256, ymm2, ymm1","vaesdeclast ymm3/m256, ymm2, ymm1","EVEX.256.66.0F38.WIG DF /r","V","V","VAES AVX512VL","","","Y","","Perform the last round of an AES decryption flow, using the Equivalent Inverse Cipher, using two 128- bit data (state) from ymm2 with two 128-bit round keys from ymm3/m256; store the result in ymm1."
"VAESDECLAST ymm1, ymm2, ymm3/m256","VAESDECLAST ymm3/m256, ymm2, ymm1","vaesdeclast ymm3/m256, ymm2, ymm1","VEX.256.66.0F38.WIG DF /r","V","V","VAES","","","Y","","Perform the last round of an AES decryption flow, using the Equivalent Inverse Cipher, using two 128- bit data (state) from ymm2 with two 128-bit round keys from ymm3/m256; store the result in ymm1."
"VAESDECLAST zmm1, zmm2, zmm3/m512","VAESDECLAST zmm3/m512, zmm2, zmm1","vaesdeclast zmm3/m512, zmm2, zmm1","EVEX.512.66.0F38.WIG DF /r","V","V","VAES AVX512F","","","Y","","Perform the last round of an AES decryption flow, using the Equivalent Inverse Cipher, using four128-bit data (state) from zmm2 with four 128-bit round keys from zmm3/m512; store the result in zmm1."
"VAESENC xmm1, xmm2, xmm3/m128","VAESENC xmm3/m128, xmm2, xmm1","vaesenc xmm3/m128, xmm2, xmm1","EVEX.128.66.0F38.WIG DC /r","V","V","VAES AVX512VL","","","Y","","Perform one round of an AES encryption flow, using one 128-bit data (state) from xmm2 with one 128-bit round key from the xmm3/m128; store the result in xmm1."
"VAESENC xmm1, xmm2, xmm3/m128","VAESENC xmm3/m128, xmm2, xmm1","vaesenc xmm3/m128, xmm2, xmm1","VEX.128.66.0F38.WIG DC /r","V","V","AES AVX","","","Y","","Perform one round of an AES encryption flow, using one 128-bit data (state) from xmm2 with one 128-bit round key from the xmm3/m128; store the result in xmm1."
"VAESENC ymm1, ymm2, ymm3/m256","VAESENC ymm3/m256, ymm2, ymm1","vaesenc ymm3/m256, ymm2, ymm1","EVEX.256.66.0F38.WIG DC /r","V","V","VAES AVX512VL","","","Y","","Perform one round of an AES encryption flow, using two 128-bit data (state) from ymm2 with two 128-bit round keys from the ymm3/m256; store the result in ymm1."
"VAESENC ymm1, ymm2, ymm3/m256","VAESENC ymm3/m256, ymm2, ymm1","vaesenc ymm3/m256, ymm2, ymm1","VEX.256.66.0F38.WIG DC /r","V","V","VAES","","","Y","","Perform one round of an AES encryption flow, using two 128-bit data (state) from ymm2 with two 128-bit round keys from the ymm3/m256; store the result in ymm1."
"VAESENC zmm1, zmm2, zmm3/m512","VAESENC zmm3/m512, zmm2, zmm1","vaesenc zmm3/m512, zmm2, zmm1","EVEX.512.66.0F38.WIG DC /r","V","V","VAES AVX512F","","","Y","","Perform one round of an AES encryption flow, using four 128-bit data (state) from zmm2 with four 128-bit round keys from the zmm3/m512; store the result in zmm1."
"VAESENCLAST xmm1, xmm2, xmm3/m128","VAESENCLAST xmm3/m128, xmm2, xmm1","vaesenclast xmm3/m128, xmm2, xmm1","EVEX.128.66.0F38.WIG DD /r","V","V","VAES AVX512VL","","","Y","","Perform the last round of an AES encryption flow, using one 128-bit data (state) from xmm2 with one 128-bit round key from xmm3/m128; store the result in xmm1."
"VAESENCLAST xmm1, xmm2, xmm3/m128","VAESENCLAST xmm3/m128, xmm2, xmm1","vaesenclast xmm3/m128, xmm2, xmm1","VEX.128.66.0F38.WIG DD /r","V","V","AES AVX","","","Y","","Perform the last round of an AES encryption flow, using one 128-bit data (state) from xmm2 with one 128-bit round key from xmm3/m128; store the result in xmm1."
"VAESENCLAST ymm1, ymm2, ymm3/m256","VAESENCLAST ymm3/m256, ymm2, ymm1","vaesenclast ymm3/m256, ymm2, ymm1","EVEX.256.66.0F38.WIG DD /r","V","V","VAES AVX512VL","","","Y","","Perform the last round of an AES encryption flow, using two 128-bit data (state) from ymm2 with two 128-bit round keys from ymm3/m256; store the result in ymm1."
"VAESENCLAST ymm1, ymm2, ymm3/m256","VAESENCLAST ymm3/m256, ymm2, ymm1","vaesenclast ymm3/m256, ymm2, ymm1","VEX.256.66.0F38.WIG DD /r","V","V","VAES","","","Y","","Perform the last round of an AES encryption flow, using two 128-bit data (state) from ymm2 with two 128-bit round keys from ymm3/m256; store the result in ymm1."
"VAESENCLAST zmm1, zmm2, zmm3/m512","VAESENCLAST zmm3/m512, zmm2, zmm1","vaesenclast zmm3/m512, zmm2, zmm1","EVEX.512.66.0F38.WIG DD /r","V","V","VAES AVX512F","","","Y","","Perform the last round of an AES encryption flow, using four 128-bit data (state) from zmm2 with four 128-bit round keys from zmm3/m512; store the result in zmm1."
"VAESIMC xmm1, xmm2/m128","VAESIMC xmm2/m128, xmm1","vaesimc xmm2/m128, xmm1","VEX.128.66.0F38.WIG DB /r","V","V","Both AES and AVX flags","","","","","Perform the InvMixColumn transformation on a 128-bit round key from xmm2/m128 and store the result in xmm1."
"VAESKEYGENASSIST xmm1, xmm2/m128, imm8","VAESKEYGENASSIST imm8, xmm2/m128, xmm1","vaeskeygenassist imm8, xmm2/m128, xmm1","VEX.128.66.0F3A.WIG DF /r ib","V","V","Both AES and AVX flags","","","","","Assist in AES round key generation using 8 bits Round Constant (RCON) specified in the immediate byte, operating on 128 bits of data specified in xmm2/m128 and stores the result in xmm1."
"VANDNPD xmm1 {k1}{z}, xmm2, xmm3/m128/m64bcst","VANDNPD xmm3/m128/m64bcst, xmm2, xmm1 {k1}{z}","vandnpd xmm3/m128/m64bcst, xmm2, xmm1 {k1}{z}","EVEX.128.66.0F.W1 55 /r","V","V","AVX512VL AVX512DQ","","","","","Return the bitwise logical AND NOT of packed double precision floating-point values in xmm2 and xmm3/m128/m64bcst subject to writemask k1."
"VANDNPD xmm1, xmm2, xmm3/m128","VANDNPD xmm3/m128, xmm2, xmm1","vandnpd xmm3/m128, xmm2, xmm1","VEX.128.66.0F 55 /r","V","V","AVX","","","","","Return the bitwise logical AND NOT of packed double precision floating-point values in xmm2 and xmm3/mem."
"VANDNPD ymm1 {k1}{z}, ymm2, ymm3/m256/m64bcst","VANDNPD ymm3/m256/m64bcst, ymm2, ymm1 {k1}{z}","vandnpd ymm3/m256/m64bcst, ymm2, ymm1 {k1}{z}","EVEX.256.66.0F.W1 55 /r","V","V","AVX512VL AVX512DQ","","","","","Return the bitwise logical AND NOT of packed double precision floating-point values in ymm2 and ymm3/m256/m64bcst subject to writemask k1."
"VANDNPD ymm1, ymm2, ymm3/m256","VANDNPD ymm3/m256, ymm2, ymm1","vandnpd ymm3/m256, ymm2, ymm1","VEX.256.66.0F 55 /r","V","V","AVX","","","","","Return the bitwise logical AND NOT of packed double precision floating-point values in ymm2 and ymm3/mem."
"VANDNPD zmm1 {k1}{z}, zmm2, zmm3/m512/m64bcst","VANDNPD zmm3/m512/m64bcst, zmm2, zmm1 {k1}{z}","vandnpd zmm3/m512/m64bcst, zmm2, zmm1 {k1}{z}","EVEX.512.66.0F.W1 55 /r","V","V","AVX512DQ","","","","","Return the bitwise logical AND NOT of packed double precision floating-point values in zmm2 and zmm3/m512/m64bcst subject to writemask k1."
"VANDNPS xmm1 {k1}{z}, xmm2, xmm3/m128/m32bcst","VANDNPS xmm3/m128/m32bcst, xmm2, xmm1 {k1}{z}","vandnps xmm3/m128/m32bcst, xmm2, xmm1 {k1}{z}","EVEX.128.0F.W0 55 /r","V","V","AVX512VL AVX512DQ","","","","","Return the bitwise logical AND of packed single precision floating-point values in xmm2 and xmm3/m128/m32bcst subject to writemask k1."
"VANDNPS xmm1, xmm2, xmm3/m128","VANDNPS xmm3/m128, xmm2, xmm1","vandnps xmm3/m128, xmm2, xmm1","VEX.128.0F 55 /r","V","V","AVX","","","","","Return the bitwise logical AND NOT of packed single precision floating-point values in xmm2 and xmm3/mem."
"VANDNPS ymm1 {k1}{z}, ymm2, ymm3/m256/m32bcst","VANDNPS ymm3/m256/m32bcst, ymm2, ymm1 {k1}{z}","vandnps ymm3/m256/m32bcst, ymm2, ymm1 {k1}{z}","EVEX.256.0F.W0 55 /r","V","V","AVX512VL AVX512DQ","","","","","Return the bitwise logical AND of packed single precision floating-point values in ymm2 and ymm3/m256/m32bcst subject to writemask k1."
"VANDNPS ymm1, ymm2, ymm3/m256","VANDNPS ymm3/m256, ymm2, ymm1","vandnps ymm3/m256, ymm2, ymm1","VEX.256.0F 55 /r","V","V","AVX","","","","","Return the bitwise logical AND NOT of packed single precision floating-point values in ymm2 and ymm3/mem."
"VANDNPS zmm1 {k1}{z}, zmm2, zmm3/m512/m32bcst","VANDNPS zmm3/m512/m32bcst, zmm2, zmm1 {k1}{z}","vandnps zmm3/m512/m32bcst, zmm2, zmm1 {k1}{z}","EVEX.512.0F.W0 55 /r","V","V","AVX512DQ","","","","","Return the bitwise logical AND of packed single precision floating-point values in zmm2 and zmm3/m512/m32bcst subject to writemask k1."
"VANDPD xmm1 {k1}{z}, xmm2, xmm3/m128/m64bcst","VANDPD xmm3/m128/m64bcst, xmm2, xmm1 {k1}{z}","vandpd xmm3/m128/m64bcst, xmm2, xmm1 {k1}{z}","EVEX.128.66.0F.W1 54 /r","V","V","AVX512VL AVX512DQ","","","","","Return the bitwise logical AND of packed double precision floating-point values in xmm2 and xmm3/m128/m64bcst subject to writemask k1."
"VANDPD xmm1, xmm2, xmm3/m128","VANDPD xmm3/m128, xmm2, xmm1","vandpd xmm3/m128, xmm2, xmm1","VEX.128.66.0F 54 /r","V","V","AVX","","","","","Return the bitwise logical AND of packed double precision floating-point values in xmm2 and xmm3/mem."
"VANDPD ymm1 {k1}{z}, ymm2, ymm3/m256/m64bcst","VANDPD ymm3/m256/m64bcst, ymm2, ymm1 {k1}{z}","vandpd ymm3/m256/m64bcst, ymm2, ymm1 {k1}{z}","EVEX.256.66.0F.W1 54 /r","V","V","AVX512VL AVX512DQ","","","","","Return the bitwise logical AND of packed double precision floating-point values in ymm2 and ymm3/m256/m64bcst subject to writemask k1."
"VANDPD ymm1, ymm2, ymm3/m256","VANDPD ymm3/m256, ymm2, ymm1","vandpd ymm3/m256, ymm2, ymm1","VEX.256.66.0F 54 /r","V","V","AVX","","","","","Return the bitwise logical AND of packed double precision floating-point values in ymm2 and ymm3/mem."
"VANDPD zmm1 {k1}{z}, zmm2, zmm3/m512/m64bcst","VANDPD zmm3/m512/m64bcst, zmm2, zmm1 {k1}{z}","vandpd zmm3/m512/m64bcst, zmm2, zmm1 {k1}{z}","EVEX.512.66.0F.W1 54 /r","V","V","AVX512DQ","","","","","Return the bitwise logical AND of packed double precision floating-point values in zmm2 and zmm3/m512/m64bcst subject to writemask k1."
"VANDPS xmm1 {k1}{z}, xmm2, xmm3/m128/m32bcst","VANDPS xmm3/m128/m32bcst, xmm2, xmm1 {k1}{z}","vandps xmm3/m128/m32bcst, xmm2, xmm1 {k1}{z}","EVEX.128.0F.W0 54 /r","V","V","AVX512VL AVX512DQ","","","","","Return the bitwise logical AND of packed single precision floating-point values in xmm2 and xmm3/m128/m32bcst subject to writemask k1."
"VANDPS xmm1, xmm2, xmm3/m128","VANDPS xmm3/m128, xmm2, xmm1","vandps xmm3/m128, xmm2, xmm1","VEX.128.0F 54 /r","V","V","AVX","","","","","Return the bitwise logical AND of packed single precision floating-point values in xmm2 and xmm3/mem."
